reviewId,content,score,gender,location,date
16304d64-120b-4c0a-975b-509f397c0335,I’d say you need to pay to get visibility. It ends up feeling repetitive.,2,male,"Riyadh, Saudi Arabia",2019-08-21
5bebfe28-8d77-45f2-96fb-fab35db2565a,"Honestly, it makes me compare myself too much. It makes the experience less enjoyable.",2,male,"Quito, Ecuador",2022-04-09
4035436a-ebc9-40e3-b355-6b5e7fb6c36f,"For me, i keep seeing the same content repeatedly. It slows things down.",2,male,"Manila, Philippines",2020-02-02
1ed4f3da-497d-405e-a08e-3267a36437a8,"So far, the app feels too complicated now. That part could definitely be improved.",2,male,"Osaka, Japan",2019-10-02
7826a04f-7bed-4ca0-bedd-3bc4cf1d095b,"Personally, sometimes it feels hard to grow organically. It gets frustrating after a while.",2,male,"Milan, Italy",2018-11-02
acb0b28b-1cbc-490c-b123-69d06fd74553,The main problem is that my posts barely reach anyone anymore. It gets frustrating after a while.,2,male,"Cairo, Egypt",2020-08-01
c1fde40d-66e1-443a-8304-1a3b059c3032,"For me, it feels like everything is about Reels now. That part could definitely be improved.",2,male,"Dakar, Senegal",2020-07-02
97354415-8e93-4382-922e-b0cfe7cdcda8,The main problem is that i have followers but very little engagement. It makes the experience less enjoyable.,2,male,"Chicago, United States",2021-10-10
e1fb4720-d3b6-4f83-a618-13028041a00e,"In my experience, there are too many bots and fake accounts. It makes the app harder to enjoy.",2,male,"Berlin, Germany",2019-02-01
884005b2-8abb-42cc-a9d4-992f15c7cb16,The main problem is that my account got restricted without a clear reason. It slows things down.,2,male,"Copenhagen, Denmark",2019-06-17
3082e58b-222e-4824-a43d-4e0b39bd0257,One issue is that you need to pay to get visibility. It slows things down.,2,male,"Vienna, Austria",2018-11-02
7ddca2c1-9ad6-433b-8900-84760e5e874a,What bothers me is that it makes me compare myself too much. It makes the experience less enjoyable.,2,male,"Geneva, Switzerland",2019-04-13
00ee80ce-2624-4b89-9df6-ada0016e846c,"So far, i keep seeing the same content repeatedly. It makes the app harder to enjoy.",2,male,"Calgary, Canada",2021-09-27
a2674979-c988-46de-94ca-8f16828c8b61,What bothers me is that the app feels too complicated now. It gets frustrating after a while.,2,male,"Kampala, Uganda",2020-08-07
460d34ae-202c-4b9f-9524-9e16b0628d21,"In my experience, sometimes it feels hard to grow organically. It slows things down.",2,male,"Lagos, Nigeria",2020-03-24
02cf9ab9-7e7b-477f-be72-11d8444aa28f,"Honestly, my posts barely reach anyone anymore. It makes the experience less enjoyable.",2,male,"Guadalajara, Mexico",2021-04-24
8377b142-310e-415c-ae2a-afc966e4cccd,"Personally, it feels like everything is about Reels now. It makes it harder to grow.",2,female,"Gold Coast, Australia",2023-04-21
445aa3a5-5a9c-4719-9b29-b3ecaaeb1f58,"Personally, i have followers but very little engagement. It makes the app harder to enjoy.",2,female,"Caracas, Venezuela",2022-07-29
72db2e09-271b-42d4-a59b-ccb8488eb3d1,What bothers me is that there are too many bots and fake accounts. It ends up feeling repetitive.,2,male,"Rosario, Argentina",2021-12-16
3caecb52-dfc9-4bf1-b32d-48870db671a9,"So far, my account got restricted without a clear reason. It slows things down.",2,female,"Auckland, New Zealand",2022-12-16
3337e62a-09a5-4d90-b093-8468c49e0fe7,"Personally, you need to pay to get visibility. It ends up feeling repetitive.",2,male,"Prague, Czech Republic",2018-12-10
26235c8f-9f40-429a-9a61-34195ca00a7b,What bothers me is that it makes me compare myself too much. It makes the experience less enjoyable.,2,male,"Valencia, Spain",2019-01-31
bea7df67-789f-4da8-82ae-3025fc8b37d4,"Personally, i keep seeing the same content repeatedly. It makes the app harder to enjoy.",2,male,"Mombasa, Kenya",2020-12-04
b26835d7-dfca-4340-8067-8f0f5574e8f6,"For me, the app feels too complicated now. It slows things down.",2,male,"Casablanca, Morocco",2020-05-10
9fef0602-a27f-49d1-8e18-15ad6570b6ae,"For me, sometimes it feels hard to grow organically. That part could definitely be improved.",2,female,"Canberra, Australia",2023-01-17
6a64ff27-c10e-42a3-b18f-3863473d202f,The main problem is that my posts barely reach anyone anymore.,2,male,"Los Angeles, United States",2020-12-30
6f391455-02d4-4f67-8a65-bd49347a1854,I’d say it feels like everything is about Reels now. That part could definitely be improved.,2,male,"Austin, United States",2021-03-24
c683fd4a-bde6-4911-9551-5ed118ae36d2,I’d say i have followers but very little engagement. It gets frustrating after a while.,2,female,"Canberra, Australia",2022-11-08
6be68720-f45a-4be3-8198-4e0c047369c7,What bothers me is that there are too many bots and fake accounts. It ends up feeling repetitive.,2,male,"Nairobi, Kenya",2020-10-20
69e40091-adb3-4b93-976b-961413b144a8,The main problem is that my account got restricted without a clear reason. That part could definitely be improved.,2,female,"Queenstown, New Zealand",2022-10-08
b3dd466c-0d2b-4727-aac5-df7b40ac4141,I’d say you need to pay to get visibility. It makes it harder to grow.,2,male,"Bangkok, Thailand",2019-12-02
5fd868a2-d0fa-4518-8d03-63b9aecb2fe5,One issue is that it makes me compare myself too much.,2,male,"Abu Dhabi, United Arab Emirates",2020-01-05
3e4c3491-674e-40d3-891f-033e9f7a0a89,I’d say i keep seeing the same content repeatedly. That part could definitely be improved.,2,male,"Mombasa, Kenya",2020-04-05
a7d1ac87-8820-4e4d-b8df-6af7dd31d953,"Personally, the app feels too complicated now. It makes the experience less enjoyable.",2,male,"San Jose, United States",2021-04-06
ae004a01-6959-4956-927a-e2b4b710476c,The main problem is that sometimes it feels hard to grow organically. It gets frustrating after a while.,2,male,"Bangkok, Thailand",2019-10-08
44d31946-8419-49b3-8462-e323638265ea,One issue is that my posts barely reach anyone anymore. It makes it harder to grow.,2,male,"Guadalajara, Mexico",2021-10-30
481d7aab-e46b-409b-bc3c-b76414dbe629,"I wanted to like it, but it feels like everything is about Reels now.",2,male,"Copenhagen, Denmark",2019-06-01
c275caa9-072b-40a3-90f8-5fd9f7accef4,"In my experience, i have followers but very little engagement. It makes it harder to grow.",2,male,"Copenhagen, Denmark",2019-03-11
ec95086f-5104-4f53-b38d-0b2a094479b4,"For me, there are too many bots and fake accounts. It makes the experience less enjoyable.",2,female,"Brisbane, Australia",2022-09-27
2bd04c4f-4dfc-49da-a150-d5a2a98ac5cd,"Personally, my account got restricted without a clear reason. It gets frustrating after a while.",2,male,"Kathmandu, Nepal",2019-11-05
0206fc96-fce7-4591-8ec1-2eaca53cc3a0,One issue is that you need to pay to get visibility. That part could definitely be improved.,2,male,"Cape Town, South Africa",2020-07-11
7c25b5ca-eaa2-49a8-8dcf-866694d209b9,"Personally, it makes me compare myself too much. That part could definitely be improved.",2,male,"Chicago, United States",2021-05-16
8a48734e-ffda-4063-849f-fa5300a472ee,"Honestly, i keep seeing the same content repeatedly. It gets frustrating after a while.",2,male,"New York, United States",2021-03-01
34f64a7d-8824-457c-a377-b9d74655513e,The main problem is that the app feels too complicated now. It makes it harder to grow.,2,male,"Paris, France",2019-02-09
1e2d066c-9dd7-474a-8a7b-e5a95f2a8ebc,"In my experience, sometimes it feels hard to grow organically. It ends up feeling repetitive.",2,female,"Melbourne, Australia",2022-10-03
298ac3bd-3b73-4277-9573-ebb308e40d3e,"So far, my posts barely reach anyone anymore. It slows things down.",2,female,"Gold Coast, Australia",2023-02-09
e0f1f674-2921-40cc-80e2-4b41ca200365,"Personally, it feels like everything is about Reels now. It ends up feeling repetitive.",2,male,"Salvador, Brazil",2022-06-23
5313c73a-b7af-460e-8b13-d2f482eb00d8,One issue is that i have followers but very little engagement. It ends up feeling repetitive.,2,male,"Dubai, United Arab Emirates",2020-01-22
9962d798-c452-46bf-9fa6-5d9ced5d4332,One issue is that there are too many bots and fake accounts. That part could definitely be improved.,2,male,"Chicago, United States",2021-03-04
457a3138-9c5f-4a98-955d-44561d153ac6,One issue is that my account got restricted without a clear reason. It ends up feeling repetitive.,2,male,"Abuja, Nigeria",2020-04-24
9a433e1e-a784-4613-a116-23ec4f36958f,"So far, you need to pay to get visibility. It makes it harder to grow.",2,male,"Tijuana, Mexico",2021-04-18
73ca45c7-24b0-4cdb-8c4e-c95f14572ca9,I’d say it makes me compare myself too much. That part could definitely be improved.,2,female,"Queenstown, New Zealand",2023-03-20
04d8fcb0-df8b-460b-b0fd-c9d9d7a1ffdb,The main problem is that i keep seeing the same content repeatedly. It gets frustrating after a while.,2,male,"Mumbai, India",2020-03-09
b885c17e-325d-4f3b-bbdd-f1c2c102d70a,"Personally, the app feels too complicated now. It makes the app harder to enjoy.",2,male,"Guadalajara, Mexico",2021-10-26
426c3326-3626-4692-b9fc-745af44e3d1b,What bothers me is that sometimes it feels hard to grow organically. It makes the app harder to enjoy.,2,male,"Cape Town, South Africa",2020-04-01
4c698ae7-a6c9-4f8e-8c9d-a80cf02e9415,Good but iss app par kuch ganday log bhi massage kartay hai jo humay mentally tocher kartay hai Itnay ganday ganday massage kartay hai ki hum pad bhi nahi saktay it's my first experience in instagram app 😠😠😠😠,2,male,"Quito, Ecuador",2022-04-20
653d0ce2-79d1-4502-978d-85634b6908a5,Awesome 👍 ahes Bhai lok n1 meta best 👍,2,male,"Abuja, Nigeria",2020-04-01
38bde67d-32cc-4539-a0aa-b82e6bbca847,Why your app use so much data? It irritate us,2,female,"Wellington, New Zealand",2022-10-30
317ac3b6-efd0-4852-9590-477047d493a7,"Been trying to create a reel and post it for the past 1 week but couldn't, so i tried to uninstall and reinstall the app, and now it's worse, i think it's gone back to like the old version. What do i do?",2,male,"Buenos Aires, Argentina",2022-03-13
1f82ca67-c6a5-469d-8066-0273e1d346a1,. زی.,2,male,"Arequipa, Peru",2022-03-31
85519797-c40e-483c-9bf8-f83ba45737b0,Instagram not downloady phone,2,male,"Algiers, Algeria",2020-11-27
69c40c54-c383-457b-8c12-719e9a25b739,Past 1 week I couldn't hear the audio of storys..Many bugs are here to clear it...so gave 2 stars⭐,2,male,"Karachi, Pakistan",2019-09-22
8e1fb8d1-7c0a-4a59-853e-334c4e40fa11,have bug for storry,2,male,"Athens, Greece",2018-12-13
2f32397b-a601-4010-aca3-68e631e76814,"(I think this is an Android problem) Whenever I post on my status the text always comes out blurry/unreadable and trust me, it looks very ugly and it's annoying. So please fix this issue asap, thanks.",2,male,"Addis Ababa, Ethiopia",2020-03-25
63cb1f93-6faa-43ab-bc55-ca70c80aefea,First account u have no filters,2,male,"Dublin, Ireland",2018-12-06
8dd04b70-870d-43f6-ad23-c4d545a2db36,Consume too much of our time,2,male,"Buenos Aires, Argentina",2021-12-07
0a300520-b3aa-4d6e-be3e-d8842fec70cf,"if unhappy scvq e ,,zxxtfxxxxty,f cz",2,male,"San Jose, United States",2021-10-28
73307eeb-c6ea-4dab-9a89-40146db63dad,This app is very nice but my reel is not uploading and after the new update and I can't see anything it's all blank.my instagram is not working . Instagram solve my problem please I try to upload half hour my video is not uploading and I clear cache but video is not upload and I try again and again but video is not uploading instagram please solve my problem my Instagram is not working plēāse solve my problems,2,male,"Kumasi, Ghana",2020-09-23
ce75cb32-0e7b-474c-8167-64c23846f6c2,This app is good,2,male,"São Paulo, Brazil",2022-04-09
71058bc2-e2aa-4f63-b126-041e40528856,"My account is being controlled for some other reasons I'm not sure of, feed is cut short.",2,male,"Ottawa, Canada",2021-03-18
6b720af2-c51b-4ea3-94f2-f9d07a968785,None of what I am sending is going through to my main groupchat and it's extremely frustrating,2,male,"Lyon, France",2018-12-11
8958a0bd-7f69-44c1-adb3-70e4dad26e1e,Just updated it and can't comment,2,male,"Athens, Greece",2019-05-18
6ad7ebd8-4534-41a3-8876-5c2392374dc9,There is no reel option,2,male,"Dubai, United Arab Emirates",2019-08-24
d2981457-8516-4411-97f3-0b6d399fe452,It helps to communicate with people,2,male,"Lusaka, Zambia",2020-04-18
49a35d44-2437-425e-88ea-69d40d6c0f0c,Kuch story lagane pr sirf green hi dikhti hai solved this problem,2,male,"Berlin, Germany",2018-12-31
4f571926-5411-4916-b306-1eaa8ba557c7,At first itself it block my like button and without any pre notice it block the id,2,male,"Guadalajara, Mexico",2021-07-11
8122c5dd-d45b-446a-a0a5-870a6b1a9571,Unable to add music on posts even after updating this app many times,2,male,"Seattle, United States",2021-02-06
9d1cea32-bd4d-4fe9-a18f-e8bc994e0ce6,Stories were not posted properly,2,male,"Los Angeles, United States",2021-08-01
368871d3-05c4-4045-b3b5-fdb6810a848c,The good Instagram,2,male,"Marrakesh, Morocco",2020-09-26
1ad091e9-c178-4982-a9bb-8cf35ed46a90,🤗,2,female,"Nadi, Fiji",2022-08-20
530bec50-8fbb-438c-9a6e-58e1ac420d1d,Mid.,2,male,"Durban, South Africa",2020-11-01
ba9e9749-b576-46ca-92b8-fb6183982b03,Best app,2,male,"Lyon, France",2018-10-31
38d97fe0-9518-4cb6-8a95-c3a21b18b1df,Please help l my report message not a to Instagram team please check your system Mr_mysterious_23,2,female,"Wellington, New Zealand",2022-10-02
646cf3d2-b334-488e-9a92-959c492ff42f,Can't post the reels... bugging long time,2,male,"Phoenix, United States",2021-10-05
0a01dbb9-69d3-4077-a509-c62bdbc742d8,Reply option not show and only heart shape emoji appeared,2,female,"Quito, Ecuador",2022-07-10
2a1e4175-7e09-4576-8381-31daba3e20b3,"My Instagram app is not working from last 2 days. I am facing trouble when accessing the reels, they are stuck and every now and then the thing that pops is ' Something went wrong' even though I uninstalled and reinstalled but nothing worked.",2,female,"Port Moresby, Papua New Guinea",2023-02-10
e9d079ee-fdf3-47e1-8b1b-4567af158e33,Time destroyer app,2,male,"Marseille, France",2018-12-29
c61693e7-3de4-48d9-93fd-d56de4d52019,"Why don't you allow porn, is YouTube your mum? Because now reality Kings has to do things done in normal Hollywood movies, as if that's what I'm looking for, otherwise, you're good. But allow a feature that enables one to download shorts or images, to view offline, and also send long videos",2,male,"Jerusalem, Israel",2019-11-02
3a176029-b649-4b12-864f-37de326452c7,Tik tok ban gya pura ye app 😆😆,2,male,"Vienna, Austria",2019-01-19
2d51e641-1dec-4d1f-8bf1-aa2caffb5ec3,What the hell!! Reels are not showing up there's some sort of error please look after it.. It kinda irritating,2,male,"Casablanca, Morocco",2020-09-08
1b9358a5-e917-42e9-8355-afff81bf699f,सुपर एप्प,2,female,"Queenstown, New Zealand",2022-09-16
b9e4ddcf-1a2b-41fe-a7d2-d95d11c483e1,Make the calling feature better,2,male,"Rome, Italy",2019-02-18
42a05996-1a8a-4c49-b4d1-286893b1c3df,Get better,2,male,"Marrakesh, Morocco",2020-12-03
376205d3-0d6a-454b-8fb8-023a2c4b870f,Reels views are insufficient. Plz check my account @duetking_mani_for_you,2,male,"Amsterdam, Netherlands",2019-05-03
ff1a41dc-aefd-4d0a-a67b-7e303a491a05,Installing so late instogram,2,male,"Asunción, Paraguay",2022-04-17
fd35b41c-26c0-41a7-807e-eaf3e414dc73,There's allot of people who have no idea who I am and what I am really looking for it moves so fast that you can't tell who's real,2,female,"Rio de Janeiro, Brazil",2022-08-10
183898d6-e047-465f-aa78-9464a0ab6034,Nice✌,2,male,"Valencia, Spain",2018-12-16
0eba1282-cba6-4f43-9dff-7db7bbc38a06,Repetitive af. Trying so hard to be tiktok+snapchat. Hate the subscription feature and the freaking ads everywhere.,3,male,"Cancun, Mexico",2018-04-26
1b3a86ee-c5ce-4163-b8aa-1ce2648333ed,Some times reel are stuck,3,male,"Lahore, Pakistan",2017-03-10
cfbcfab6-86a5-4856-8a97-2c92c9ffd8ee,"Burns up more of my day than I'd like, but. there are some interesting items on occasion.",3,female,"Sydney, Australia",2020-06-12
6f8a7daf-9866-4cca-95c7-471137c34a9a,Goof,3,female,"Adelaide, Australia",2020-05-29
c09dfe7f-82de-4842-9878-dac32426aed0,Awesome ❤️,3,male,"Austin, United States",2018-11-25
d12af347-06a5-4a0a-b639-f8a0b60d9b4a,Ads payment is very higher,3,female,"Port Moresby, Papua New Guinea",2020-07-17
dd05612f-6ea1-49e3-8054-36dff0a29545,Viral my one video please,3,male,"Nairobi, Kenya",2017-09-02
9f275707-76af-4da3-b68c-0505dd68e89b,Bad,3,female,"Wellington, New Zealand",2020-03-13
05fa9cb2-c1b1-4581-bdf1-e6b4e84de74f,I like insta but video download to gallery options chahiye,3,male,"Accra, Ghana",2018-01-30
9a407a0c-47a3-4ccf-9f70-edec8fb28aab,Thx,3,male,"Doha, Qatar",2017-03-04
f88f152f-f616-4a03-9b7d-4bfcabed5a90,Hjm on JJ j,3,female,"Port Moresby, Papua New Guinea",2020-05-24
3041b06d-bf4e-4eb8-a67d-fc675376fed5,"G g,,y,you.you NJ",3,male,"São Paulo, Brazil",2019-03-23
c2aba1d8-7c53-4f2a-907d-860b0622f508,"Something happened to my account. A lot of songs are shown as ""The song is currently unavailable"" on my account.. Please Help.",3,male,"Barcelona, Spain",2016-05-23
bafdfae1-818b-4a89-9520-93b9732d2632,"You update every day, but there is still a problem, or one of the options is disabled, or there are no rails, or there is no single story for it.",3,female,"Nadi, Fiji",2020-01-27
46427f96-fd6f-40cb-8c14-1fb415cea485,nice,3,male,"Rosario, Argentina",2019-04-20
b00dc834-69f7-4586-beca-def2667dec90,.........................................................................................................................................................................................................................................................................................................................................................................................................................................................................I am unable on load effects on instagram ..,3,male,"Montreal, Canada",2018-11-10
f7c1b0a8-f7d5-41c4-b375-d4380514478a,5 G IS A GOOD IDEA TO GET THE BEST 3334RBDEJ3JWJQRJ5J4DEDRD4WJEHD 4D5 3WED4ST3jqjhh5hz5ah,3,male,"Medellín, Colombia",2019-06-11
ecf494e2-233e-400d-b4f6-d9db489c69b8,Cannot add location,3,male,"Doha, Qatar",2017-04-02
ac3ffe37-326c-4ce1-84b9-34c34faaba7c,It's always shows something went to wrong,3,male,"Tijuana, Mexico",2018-11-03
3dac0449-ff2a-490d-a43b-f3561ace9f9d,Works 50% of time,3,female,"Quito, Ecuador",2019-10-26
cd0f2bb5-de73-4f1c-8d9e-fcacceee9e4f,Yeah ! It's Fine But Probablly I find A Lot Of Issues In the app Just Like Hanging and Like .. Whatever Else ! Plz Try To Update!!,3,male,"Budapest, Hungary",2016-05-05
793a3098-117a-401a-82be-b0e414d3d395,Nice app,3,male,"Manchester, United Kingdom",2016-09-09
2f750e91-6f9a-40ab-bb18-8e29d7ec5189,No tiempo para tu,3,female,"Canberra, Australia",2019-12-12
5cbdba25-bae9-4fe5-8318-56f9a51e5275,Many glitches are there I can't reply to msgs and can send reaction emojis to specific msgs,3,male,"San Antonio, United States",2018-12-03
fd2060e3-5006-4da9-a74d-c1cd1a7b59d7,Highlights are not working properly,3,male,"San Francisco, United States",2018-07-10
e4c94d99-c299-4a56-b3c5-594a9cb1ad7f,Vry vry nice app,3,male,"Bangalore, India",2017-03-25
949718e5-655a-41da-a63b-792d80b6d262,Good,3,male,"Seoul, South Korea",2017-06-11
c58a20cc-9d8e-4cad-929b-6a8becdefa92,Interesant,3,female,"Suva, Fiji",2020-01-31
cd558f07-bea9-479c-a90f-fce78a419392,Long status video not working this app,3,male,"Alexandria, Egypt",2018-01-08
31180cdc-4423-48a7-8cad-e726c92bf3c5,"Glitchy. It's not very user friendly when creating reels. Recent reel just uploaded upside down! I'd hate to redo everything! Cleared cache and restarted my phone , saved the reel to my phone and still ....somehow it's upside down.",3,male,"Vienna, Austria",2016-05-22
30d18851-88e1-4c8b-ac04-e8977237dd32,Fb urcki r bdhvncib,3,female,"Queenstown, New Zealand",2020-03-12
e73356f2-5ed1-41a0-b9ac-4de1080ee705,Insragram dauwnlod nahi ho raha,3,male,"Tel Aviv, Israel",2017-01-09
0414335e-e891-4010-b8de-c8bc5e266629,Why the app could not accept the message requests?,3,female,"Montevideo, Uruguay",2019-11-15
70e81eee-f038-45b6-a630-c285374906f3,Good,3,female,"Adelaide, Australia",2020-02-15
9f97888b-42b9-40dd-ad63-ed6d67336e38,Thank you for solving my problem,3,male,"Philadelphia, United States",2018-04-27
101a534f-dbba-4ec0-aa24-9e85d9138687,Mast 😍😍😍😍😍😍😍😍😍😍😍😍,3,male,"Los Angeles, United States",2018-10-30
e46d9c93-22fc-46df-9d22-cd45237067f8,So many bugs.,3,male,"Cancun, Mexico",2018-07-04
a7eb704e-5eed-43b2-8462-13285edc7fe9,Annoying,3,male,"San Diego, United States",2018-12-13
06e4f236-95cf-4d6e-a713-43c2fe30ccbd,Good but now it stop to vairal my reels,3,female,"Nadi, Fiji",2020-01-02
6f5f9927-4abc-4739-8d8c-34e22ba71787,Hii really good for you and the family f,3,male,"Busan, South Korea",2017-05-20
4f1ae680-f806-4e50-af8a-7d705e430ba3,I am not sure if you have any questions assistant professor,3,female,"Nadi, Fiji",2020-02-19
06d94753-1461-4829-b5e0-aec9ed21e22c,Op,3,male,"Ottawa, Canada",2018-09-09
2eef422a-df43-4c9b-a226-ba7da396a131,What's wrong with the link? Its always linking back to instagram even though the account tag it to another website?,3,male,"Lyon, France",2016-08-14
2fa52791-efe7-4e90-a7c4-5bd32b14cffe,I am not found my draft video,3,male,"Abu Dhabi, United Arab Emirates",2017-02-17
de527d54-e69b-4c2a-acb1-3e54fa6aa949,So pretty,3,male,"Chicago, United States",2018-10-26
b303124d-8897-4ddd-96fc-6a0adfb3edec,Dose not viral my reel 😂,3,male,"Singapore, Singapore",2017-03-10
f7040468-836b-43a5-bcdc-da50a7de4889,App is getting hanged very badly in the recent days in One plus Nord mobile...,3,male,"Helsinki, Finland",2016-09-11
dde0e065-5d08-472e-8962-db5df94c6378,Why my stories are getting blurred,3,male,"Seoul, South Korea",2016-10-31
245542ad-ca5e-4acd-898b-a43ef1718df1,Multiple emoji reaction still not available for me,3,female,"Sydney, Australia",2019-12-16
21da5433-34bc-416a-857b-252aa8626ba4,wow new version..,3,male,"San Diego, United States",2018-11-06
9113ae1f-67d7-4d2c-9f91-e617dc97250e,"It has many glitches. Though you get all the news and gossips from all sector, it's time and data consuming.",3,female,"Christchurch, New Zealand",2020-07-01
a655e8d2-377f-48bc-85bb-11d2a2249987,Beuti,3,male,"Pretoria, South Africa",2017-09-03
b0338ad0-0327-4e47-885b-fba99bc1722d,Views and likes issue plz help nothing else,3,male,"Austin, United States",2018-10-26
d9b9d2b5-2798-4760-b121-6f0f92286f7c,It is a great app,3,male,"Chicago, United States",2018-10-31
bf50e2bf-fc67-4855-914e-b0f386ac1bed,Very good app but some glitches But i haven't get themes i don't from 1 year i am using but everyone have themes i haven't themes. Plz give me themes,3,male,"Austin, United States",2018-11-28
20aca957-13a5-42a7-a2ad-44b283e0944b,Good,3,male,"Marseille, France",2016-05-13
f0f010f0-a8fe-47d1-b971-c803e1c1ff64,Quality,3,male,"Cali, Colombia",2019-07-11
b906d0b1-1619-4bef-a1c5-63153ddbdc43,अच्छा,3,female,"Wellington, New Zealand",2020-06-05
ea30aa74-0f9e-431a-ac8d-3cdb8bc46628,This is the best social app and was properly working but it's been so while that instagram notifications are lagging and it is sometimes taking more than half hours to get the notifications at first I thought it will be fixed but please do fix it. Instagram has been lagging recently 👍,3,male,"San Francisco, United States",2018-07-16
0525046a-8518-4d32-8365-4efc1f264b85,Look,3,male,"Osaka, Japan",2016-12-22
9e119558-0786-419b-980b-0a028f03ab0c,"Im having a bit of a problem with the add yours feature not working for months now. I had updated this app just a few days ago when I noticed that the add yours sticker wasn't working because it wasnt updated. Now that it is, the sticker is still not working. Can you fix this bug???",3,male,"Cali, Colombia",2019-07-15
5eec6795-40a1-4ede-9d32-1795680b9039,Video is freezing. Reels crashing.,3,male,"Milan, Italy",2016-02-16
0f024a36-0d39-43f4-a8c0-2ffcd3d6c4df,It wont fix the foces stop an it says it wont work an all,3,male,"Kampala, Uganda",2017-08-05
fd6a2e50-6428-46f2-bf3e-83df3ab2c116,"Would rather be able to upload via PC with full app capabilities, rather than just cellphone.",3,female,"Suva, Fiji",2020-04-15
5c40fca0-75b3-4802-810e-e3abcf411ecb,Yeah I like it 😊😂 from last year In 2021,3,male,"San Francisco, United States",2018-10-14
5506575f-7a9e-403a-908b-3d26e7d68674,Tafan,3,female,"Hobart, Australia",2020-01-02
86051455-4c14-4b4b-8758-3bf2f254045a,It's lagging a lot,3,male,"Mexico City, Mexico",2018-11-10
71e8b4d4-1583-4d79-8e65-56603c12f000,Kbi kbi ni chlta rookh jata hy bki great hy you can use❣️👀,3,female,"Salvador, Brazil",2019-11-09
bf641d05-6d77-459b-aa2b-d08250545766,"Nice app for social media but even though i always update the app every time they says Need to Update. Im just disappointed because the filters are few, i saw my friends Instagram there are many nice filter but why my Instagram just a few filters like 2 filters only? Please i would like to rate the app 5 if you add more filters on my Instagram. Thank you!!!!",3,female,"Adelaide, Australia",2020-02-12
410fde5f-9bd1-46c3-913b-9d50c7b3d337,It's best app,3,male,"Lagos, Nigeria",2017-07-24
6ad3ca92-1a8c-4a60-8e1c-51f5743137a1,Hi Huie Hrhrj shis,3,male,"Birmingham, United Kingdom",2016-08-28
45aef2b6-3c60-4124-bef3-f024f4a1db0b,"I used to love instagram but after this new update i am having a lots of problems with text on my reels and stories, i coant reply to messeges in my dm. So i am starting to dislike the app a bit. I tried sending a report but i cant even send report as it shows error while sending. It is a great app but latest update is not that great.",3,male,"Valparaíso, Chile",2019-05-23
664163a6-3eee-47ad-8ad5-8b05c63cdf6c,Nice aap,3,male,"Tunis, Tunisia",2018-02-08
