reviewId,content,gender,location,date,score,cluster_id,prob_topico_0,prob_topico_1,prob_topico_2,prob_topico_3,prob_topico_4,prob_topico_5
d07459c5-3a68-46b7-89f6-6901caeff3a1,From some days I am seeing some reels of stupid products that I am not interested and still I am seeing their reels while I want memes / Indian related content,male,"Nairobi, Kenya",2023-03-26,NEGATIVO,1,0.033424154,0.44821367,0.034431905,0.032074656,0.029778866,0.42207673
3d694df5-5e15-40a0-bab4-35e5d3219d2d,पुराना जितने भी रील है उसका सारा ऑडियो हटा दिया गया है और सारा भक्ति संगीत भी नही है इसमें अब पहले जैसा इंस्टाग्राम नही रहा Hindi musics are not avilable,female,"Christchurch, New Zealand",2025-10-30,NEGATIVO,0,0.71750385,0.06426714,0.053541765,0.049924728,0.046357527,0.068404965
022e99fc-22d1-4052-8b37-b69d55b2e1a1,Not Very Good having The Issue of updating Again and again 😑,male,"Hong Kong, China",2022-03-22,NEGATIVO,0,0.80733174,0.04391938,0.036483366,0.034033343,0.031588804,0.046643317
1be28850-0ead-4296-9229-42c49abf7398,White screen problem,male,"Hamburg, Germany",2022-01-02,NEGATIVO,1,0.04633704,0.759054,0.047737017,0.044500098,0.0413111,0.06106069
65cd7c01-eaf6-426a-abde-1e11080452be,"Unable to use many of its features like reaction on particular message(i can only give heart reaction to any msg). Selection of particular msg to reply doesn't work in my app. No emojies are available there, even stickers provided by app are very few and totally useless. I'm unable to use many of its filters. Songs list provided for stories or post is very short. I am unable to change the theme I reported it so many times but their is no response from your team . 😡",male,"Marseille, France",2022-01-17,NEGATIVO,0,0.5135729,0.40696847,0.01949342,0.018171882,0.016874034,0.024919279
60c9044e-9e25-4534-a902-2e7c634f4626,"It used to be nice until they started giving different features to different devices and not allowing people to get more post ,reels and story views",male,"Mexico City, Mexico",2023-09-27,NEGATIVO,0,0.47680274,0.33062074,0.026153699,0.11030065,0.022620305,0.033501834
6d9cb254-7e58-4590-a207-3725faea905d,Follow nita_x_avnii,male,"Rome, Italy",2021-07-11,NEGATIVO,4,0.064520136,0.07974274,0.066439725,0.06195131,0.6424614,0.08488464
b21edc21-b913-4830-a0db-bd815a417073,Kaifkhan,female,"Canberra, Australia",2025-10-05,NEGATIVO,5,0.15539974,0.19213073,0.1600802,0.14926584,0.13860266,0.2045208
4f3bcdc7-f50a-4529-9fd8-1fac289f022b,Sonik_a1390,male,"Caracas, Venezuela",2025-03-17,NEGATIVO,5,0.15539974,0.19213073,0.1600802,0.14926584,0.13860266,0.2045208
ab708b98-9d1a-49fd-aa6d-db5ca56be9b9,Time waste. Loading problems,male,"Geneva, Switzerland",2021-06-30,NEGATIVO,0,0.7727824,0.051651403,0.042984255,0.040078316,0.037211653,0.055292007
e88d1eac-a068-4b2d-a559-c829498cd5a5,"BRUH, I CAN'T POST MY STORIES WHAT THE HECK????",male,"Jeddah, Saudi Arabia",2022-03-26,NEGATIVO,3,0.052196465,0.06450028,0.053710364,0.714474,0.046491288,0.06862765
834275e3-cf35-4bb2-b1e6-88782a4bfaa6,I was hacked last week and I'm afraid my account was deleted. I don't wanna create a new one. I don't think I'll install this app again. It was fun though,male,"Pretoria, South Africa",2022-12-11,NEGATIVO,2,0.026228627,0.032698963,0.8578168,0.025233809,0.02339145,0.034630325
c71bca03-aa3f-48f3-b2e2-6671aee81527,My account is been temparoryly locked frequently,male,"Edinburgh, United Kingdom",2022-01-10,NEGATIVO,4,0.04172237,0.051603254,0.042976797,0.04007366,0.7686874,0.054936424
a3a1ae69-dab3-46bf-8256-23e2a4189373,My account locked frequently,male,"Guayaquil, Ecuador",2025-02-15,NEGATIVO,4,0.03821229,0.04725777,0.03936125,0.036702294,0.7881574,0.050309002
4b06aa5d-cd20-45d9-990b-c3d15910353c,Photo main song lagane ka system band hogya kya,male,"Harare, Zimbabwe",2023-01-02,NEGATIVO,1,0.03531641,0.81652063,0.036343515,0.03388886,0.03142335,0.046507243
f2c9b382-3db2-403e-9ce6-f1aef6ca5531,"Last few months the app has taken a real turn for the worst especially when it comes to making posts with multiple photos. Currently I can't even adjust the size or position of any photos, they just remain at the original state and it's getting very annoying to post anything anymore.",female,"Sydney, Australia",2025-09-22,NEGATIVO,3,0.3707765,0.030935312,0.025923038,0.5171875,0.022274788,0.032902867
0e8e156f-bcb8-4ff4-a47c-5c3b168f37e0,"There is no reason to have ads on this ap. Sponsored ads after every story, so horrible and unnecessary",male,"Tijuana, Mexico",2024-02-02,NEGATIVO,0,0.620131,0.21095902,0.04143231,0.03864693,0.03589554,0.052935157
3bcbb122-d43e-4fb8-97f6-a7097a4fda81,I love this app a lot cant spend a day without using it thank u,female,"Sydney, Australia",2025-06-11,NEGATIVO,1,0.033751316,0.824589,0.03473914,0.032382138,0.030167408,0.044371013
0deb7c8e-cd4e-4ce9-9b24-c85ac1e35796,"It could be much fun if IG had the download feature just like twitter but with a authorization option by the user on who can download their posts(public, people who follow them,close friends or no one) that could be awesome!!!!",male,"Christchurch, New Zealand",2025-04-15,NEGATIVO,1,0.29811633,0.4656731,0.15559737,0.024380306,0.022650389,0.033582527
963dd6c5-065a-4339-913b-733920f2337b,My account locked many times,female,"Nadi, Fiji",2025-07-26,NEGATIVO,0,0.44411674,0.04463625,0.036798004,0.034315053,0.3929654,0.047168586
070dac5d-fdd4-4313-86b5-3c886832b21c,account locked frequently,male,"Marrakesh, Morocco",2023-07-13,NEGATIVO,4,0.03821238,0.04725808,0.039361253,0.036702298,0.7881563,0.050309718
54525eeb-2b17-4537-a8a8-36c95f4d4503,account access problems locked,male,"Dallas, United States",2023-12-04,NEGATIVO,4,0.04197763,0.05209326,0.04325837,0.04032151,0.76701885,0.055330407
e9a8e038-2206-4d31-baec-e1fad30005cc,No followers gaining system.,male,"Medellín, Colombia",2025-01-28,NEGATIVO,1,0.052689653,0.46683592,0.05430292,0.05060174,0.04698684,0.32858294
99b12cd0-b031-4da3-81c8-90488863d9a8,"Im facing a problem with watching reels. It always shows reels with less views and like which are not even good and sometimes it shows like ""wew are sorry,but something went wrong"". I really hate this app. Worst",male,"Bali, Indonesia",2022-09-25,NEGATIVO,2,0.3750085,0.025416251,0.53540623,0.019454606,0.018036246,0.02667821
0f65fdf5-7151-42b8-8f70-8fc7f001f23b,Update,male,"San Diego, United States",2023-09-01,NEGATIVO,0,0.6486591,0.0798827,0.06651369,0.061955243,0.057526898,0.08546226
d2b96a84-d795-4d88-a86a-9273695674e7,Shivamsingh,male,"Toronto, Canada",2024-03-01,NEGATIVO,5,0.15539974,0.19213073,0.1600802,0.14926584,0.13860266,0.2045208
67f69732-7faa-4a84-adff-46b5bb9bb1a4,It keeps on crashing...,male,"Amsterdam, Netherlands",2021-07-01,NEGATIVO,5,0.06450276,0.0797408,0.06643866,0.061950333,0.05752482,0.6698426
70b466bc-75d3-406a-9f25-78746be8e90d,Fg is sss33sss3 6t33¾Xbox 033u3t seem 33,male,"Phoenix, United States",2024-02-21,NEGATIVO,5,0.15539974,0.19213073,0.1600802,0.14926584,0.13860266,0.2045208
6e463e49-ec1d-4bb6-9482-107be2f1200d,"Sorry, there was a problem with your request",male,"Dakar, Senegal",2023-05-30,NEGATIVO,0,0.7482076,0.057279587,0.04772646,0.044475097,0.04129323,0.061018076
d5372674-8409-4c15-8d42-17206a14cf29,"I want to give it 0 star, because instagram not show me my friends posts.",male,"Cali, Colombia",2025-02-12,NEGATIVO,1,0.03337955,0.82661283,0.03432903,0.03208172,0.029709797,0.043887004
2e6f74c1-eff8-4310-bfd6-3c5ddf8877d9,account locked frequently,male,"Jeddah, Saudi Arabia",2022-11-13,NEGATIVO,4,0.03821225,0.04725718,0.03936125,0.036702294,0.7881586,0.050308444
d8e6f6a5-2b5b-4bea-9af0-ffd2629fbfcf,This company is awful. Deserves 0 stars. Don't waste your time.,female,"Port Moresby, Papua New Guinea",2025-07-05,NEGATIVO,0,0.7761376,0.050976668,0.042415608,0.039550375,0.036724776,0.05419505
f54ea6aa-d2e3-4ee1-b1c7-4cf50c8210c7,Plz my account has been an blocked,male,"Chicago, United States",2024-01-26,NEGATIVO,1,0.046537552,0.75808203,0.047939107,0.044690665,0.04150167,0.06124899
27bf0b03-8a7f-48af-a13b-6276783ad302,"Sometimes videos are getting download automatically, sometimes don't, issue while posting reels",male,"Guangzhou, China",2022-04-08,NEGATIVO,1,0.032078266,0.38836902,0.03302321,0.3577313,0.028575722,0.16022243
90db54d0-871b-4aa4-bb69-b4ea44d3d616,Meta intentionally gave your girls eating disorders,male,"Buenos Aires, Argentina",2025-01-10,NEGATIVO,0,0.7177933,0.06419688,0.053486772,0.049873397,0.046310544,0.06833907
23940818-0804-4478-a173-8d3ef0a34207,Igect nhi aarha hai,male,"Chicago, United States",2024-03-23,NEGATIVO,4,0.051946606,0.06424176,0.053513594,0.049896352,0.71203595,0.068365775
af2b2716-addf-4575-9970-0745d944a458,Unable to access… account locked,male,"Glasgow, United Kingdom",2021-09-03,NEGATIVO,4,0.26659226,0.05147451,0.04290649,0.03996335,0.5442961,0.054767344
ccf205d4-d9b9-48f2-99b1-9d9c75b4da33,"It always has problems. In posts with many pictures, it often shows the second picture first. Other times, the app doesn't work without reason, as if the internet connection has stopped working (but in other apps, the connection works fine). The amount of RAM it consumes is terrible, and it seems to get worse with each update. It wasn't like that before. Quite a bad experience. 👎🏻",male,"Harare, Zimbabwe",2023-05-08,NEGATIVO,1,0.33061132,0.59460485,0.018334202,0.017112708,0.015858069,0.023478843
d65a07ca-797f-4533-bb06-ec74e790cff6,Please solve the problem of songs unavailable... Or else out edit button to update new songs for reels,male,"Monterrey, Mexico",2024-07-13,NEGATIVO,0,0.6724946,0.03313527,0.20978904,0.025648542,0.023792872,0.035139706
3bcc36f6-f938-4138-9384-d2015e8efcf1,"Pratap,Bhi",female,"Gold Coast, Australia",2025-08-17,NEGATIVO,2,0.06449926,0.07976461,0.6513677,0.061953332,0.057527505,0.08488756
5fa9e5fd-c486-4045-83fc-93837c2fa3be,It needs a very large area and I don't have that space and I can't do without it.,male,"Krakow, Poland",2021-06-06,NEGATIVO,2,0.051919393,0.064192854,0.39036676,0.04986855,0.37532237,0.06833001
8b8dce20-c479-419b-854b-68a8a72088ef,"Waist of battery,memory and more important time.",female,"Nadi, Fiji",2025-11-22,NEGATIVO,0,0.64938956,0.07978774,0.06643867,0.06195275,0.05752479,0.08490653
063cb754-3afd-4105-896e-1ffaf409136c,I created new account it shows Your Account will be suspended due to Community Guidelines on spam. Are you real?? Don't even deserve 1 star,male,"Dakar, Senegal",2023-02-24,NEGATIVO,1,0.3840779,0.49051666,0.030782059,0.028678881,0.026627554,0.03931698
dff48ee1-f2f9-4006-a2ee-fd898524c43e,Na madda lo insta,female,"Brisbane, Australia",2025-11-17,NEGATIVO,2,0.051998902,0.064319015,0.7188975,0.04996957,0.046379123,0.06843588
007c1ecd-42a2-43fd-a7c3-f492aa6dc6da,account locked access problems frequently,male,"Quebec City, Canada",2024-03-11,NEGATIVO,4,0.035793036,0.044340577,0.036878783,0.03438031,0.8014471,0.04716019
ae5e39b5-9e19-4155-af5b-a13967b28b74,Reels are not working Please help me,male,"Rio de Janeiro, Brazil",2025-03-20,NEGATIVO,3,0.035622947,0.044157185,0.036722757,0.80487025,0.03175376,0.04687316
f54b43a8-86a7-4470-b935-511ece17325e,It's a disaster after last 2 updates the songs are not supported a lot of songs are not supported I can't hear the songs or dialogues it's very disappointing,male,"Houston, United States",2024-01-20,NEGATIVO,3,0.041278586,0.051303655,0.042511083,0.7733066,0.03672198,0.054878123
5cb61771-30e1-41ad-a8d3-7b4bacc3aa11,Reels loading issues,male,"Seattle, United States",2024-04-19,NEGATIVO,5,0.04175266,0.05176376,0.04302906,0.040097803,0.03722634,0.7861303
7d7a3a77-9b38-425c-a831-1fc94a02d3cf,Reels loading too lonnnngg!!!,male,"Kathmandu, Nepal",2022-09-25,NEGATIVO,5,0.046223633,0.057179708,0.047656354,0.044392876,0.04121446,0.76333296
71d11fe2-e5fc-48d6-9a40-66e069c755d3,Resets the feed for whatever reason and idiots to whoever designed the call feature.,male,"Phoenix, United States",2024-02-10,NEGATIVO,1,0.041207865,0.7857507,0.042437453,0.039580435,0.03680159,0.054221958
10f10751-0ce5-470b-ab33-1e6fe870b745,"Buggy asf, and it won't let me post on mydays >:((",male,"La Paz, Bolivia",2024-11-08,NEGATIVO,3,0.046212275,0.057039224,0.047524735,0.74734706,0.041146774,0.060729954
3c1ac38d-fd0c-4319-983b-620e16f744d9,"I can't open my Instagram app, it always crashed, idk why....",male,"Wellington, New Zealand",2025-05-08,NEGATIVO,1,0.038631197,0.79954207,0.03970444,0.03700468,0.0343593,0.05075834
ab4e46bc-8ffc-438a-a75a-430826b9aebb,They app has bug and so much problem but this app is awesome,male,"Santa Cruz, Bolivia",2024-11-17,NEGATIVO,1,0.035652522,0.81441593,0.036625553,0.03414986,0.03171872,0.047437333
78edd186-cc93-4890-afd2-faf7d9353c2d,There is a bug in my account. I can't save the photos and vedios with the effects. For 2 days i am not able to watch reels and i have re installed for so many times and it is showing in the same way. Please do the needful. Please resolve the issues in my account. I have saved an affect and it is not showing it.,male,"Santiago, Chile",2024-08-13,NEGATIVO,1,0.02261323,0.88262093,0.023254488,0.021672923,0.020131769,0.029706668
3f220e5d-8588-442f-b380-b2c85762fcba,Cant turn off notifications Cant renove account,male,"Queenstown, New Zealand",2025-05-18,NEGATIVO,2,0.043830734,0.054774307,0.7625426,0.042030096,0.03905106,0.05777127
8de7622b-d091-4ab0-887a-e59ba2879857,Nice 👌 app if it was not for the loading time of the reels,male,"Rabat, Morocco",2022-11-26,NEGATIVO,5,0.032225724,0.039779868,0.03309442,0.030854512,0.028643334,0.83540213
b5683564-8499-46da-ba71-da80113ed3e6,LADKI MASSAGE KA REPLY NAHI DE RAHI HAI 💔😔🥀,male,"Boston, United States",2024-06-29,NEGATIVO,0,0.83700216,0.03712956,0.030897915,0.028781531,0.026749117,0.039439663
2039484d-5dc3-40bb-ab8e-02a3739885ef,"I've been having trouble logging into my account. I sent messages asking for help. But no response. It takes time loading, says error. I don't want to start a new Instagram page. I have all my pictures, friends family, co workers etc associated with my page. I loved Instagram before, but now I feel different about it. At least facebook answers your messages and helps solving any issues you may have.",male,"Tunis, Tunisia",2023-06-28,NEGATIVO,1,0.020189555,0.89507604,0.020788508,0.01936768,0.01798014,0.026598146
87b85130-9fff-467b-84c9-12e3fe21498b,"Não consigo mais logar na minha conta. Já troquei senha, já tentei acessar link de login... Nada funciona. Minha conta não foi suspensa nem hackeada. Faz quase 24 horas que não tenho mais acesso.",male,"Nairobi, Kenya",2023-03-05,NEGATIVO,3,0.04516476,0.056159075,0.046539653,0.7524121,0.040282864,0.05944164
1b7d74d2-1864-44f8-a52a-a198186fb8d2,No add a one will be song in a story like a hindi song marathi song,male,"Rabat, Morocco",2023-04-22,NEGATIVO,0,0.7798164,0.050178032,0.041693237,0.038881697,0.03607114,0.05335954
8a28d833-2c76-443c-96c0-5c10b2e8b8db,"Watch video again , just loop the thing or restart if i scroll at it again. Stop chucking me into video blaster mode .",male,"Abuja, Nigeria",2023-04-06,NEGATIVO,3,0.042436942,0.052660298,0.043731544,0.76744026,0.037843354,0.05588765
f5289c5c-6c29-4a61-a199-648a9c44cc20,Why my account is not working fixed it as soon as possible,male,"Rabat, Morocco",2022-11-17,NEGATIVO,0,0.7910638,0.047593366,0.039588515,0.03691015,0.034268774,0.05057549
9205dac8-54be-4dd2-8ce9-aa63601d22b4,So if you post something that's true they threatened to lock your account. Way to go brown coats.,male,"Austin, United States",2024-04-08,NEGATIVO,0,0.7909855,0.047562473,0.03959928,0.036964625,0.034281317,0.05060693
c4b78e1c-18f4-4d94-8374-d3ef94e69cd3,Reels are not loading,male,"Nairobi, Kenya",2023-05-24,NEGATIVO,5,0.04622347,0.057179715,0.047656916,0.044392873,0.041214455,0.7633326
d124997f-c8c9-4dcb-8e0c-053b6c41e006,Rply option is not showing,female,"Gold Coast, Australia",2025-11-17,NEGATIVO,1,0.05195468,0.7299818,0.05350469,0.049885474,0.04631977,0.06835356
f270a446-2822-45ca-abfb-82e4b687d499,I could not get otp,male,"Philadelphia, United States",2024-07-11,NEGATIVO,1,0.052083112,0.72895527,0.05380307,0.05003864,0.046447664,0.06867231
78c2b9d5-21a4-40fb-ad1c-e1dd1cfe443a,Nice 👌👌👌,male,"Karachi, Pakistan",2022-05-03,NEGATIVO,5,0.048112962,0.0593772,0.049471527,0.046145152,0.042833973,0.75405914
43494b96-1ba2-4e46-82cf-6332f8591f09,Worst experience reels were not opening bug,male,"Marrakesh, Morocco",2023-05-18,NEGATIVO,3,0.03837038,0.0476972,0.03953643,0.78938824,0.034210596,0.050797258
3e6622df-42f8-4cf7-a1c3-a860749f483e,Bugs bugs bugs… reels loading terrible,male,"Pretoria, South Africa",2022-12-30,NEGATIVO,5,0.03886262,0.29373306,0.04007736,0.037331026,0.034653973,0.55534196
dcd1e37f-d79c-4d90-a572-f302c2b23015,Plz improve reels loading time!!,male,"Valparaíso, Chile",2025-01-27,NEGATIVO,5,0.033682484,0.041714907,0.3421513,0.03220645,0.029900307,0.52034456
6d037e2b-ad49-4a67-80d4-3a89f1cf217a,I got hacked,female,"Hobart, Australia",2025-06-13,NEGATIVO,3,0.045673385,0.05646977,0.04704933,0.7499347,0.040762126,0.060110807
37030f03-315e-441b-8817-0b30ad602f23,I am unable to switch account every time even after re-downloading the app this should be fixed,female,"Wellington, New Zealand",2025-07-23,NEGATIVO,0,0.8333867,0.037917566,0.031568255,0.029432729,0.027331071,0.04036372
61f69080-aaca-41a8-9e78-c20b0e9679e2,Cope,male,"San Jose, United States",2024-06-15,NEGATIVO,5,0.15539974,0.19213073,0.1600802,0.14926584,0.13860266,0.2045208
a86e9921-70e8-460b-8c44-78ad30aabd73,Mari koi Girlfriend nhi bs meme dakh dakh ke khud ek meme bangya hai,male,"Lahore, Pakistan",2022-08-30,NEGATIVO,4,0.045290872,0.056011964,0.04665728,0.31225774,0.4801756,0.059606645
d51f543a-c302-4c8c-aed0-e0fef2b0e387,Security issues,male,"Riyadh, Saudi Arabia",2022-07-31,NEGATIVO,0,0.71271586,0.065512896,0.054379,0.050712794,0.047084972,0.06959443
42eff706-18d7-47e5-8b38-482d4f22df2d,ALGORITHM and some bugs and lags,male,"Hobart, Australia",2025-05-02,NEGATIVO,0,0.7154014,0.06519955,0.053818684,0.050201003,0.046601195,0.06877819
69a080df-b7c8-4b87-81d3-74f795daf05b,This was very bad because when delete the Instagram next new account will create old account didn't login why,male,"Philadelphia, United States",2023-11-03,NEGATIVO,2,0.030014362,0.24336344,0.63164204,0.028786791,0.026730683,0.039462693
20060781-0172-41be-8f82-4962c90fc45b,Faltu app h. Yha ladkiya replay Nhi deti h😢,male,"São Paulo, Brazil",2025-02-03,NEGATIVO,4,0.033767782,0.041808765,0.034775767,0.0324246,0.81273603,0.04448707
5930ad78-b880-4d91-ae6c-5f471f4f487b,"This is not working, I got hacked",male,"New York, United States",2024-01-17,NEGATIVO,3,0.04108758,0.050816182,0.042330436,0.7750361,0.036660206,0.05406952
fe3bb2db-409f-4dce-83df-250f0c6297c9,Supar app hai bonloing bro,male,"Medellín, Colombia",2024-10-11,NEGATIVO,4,0.046921805,0.058191683,0.04832472,0.045052346,0.7396056,0.06190383
ddbf0a07-c6ad-4f9f-bb40-fe89a7b62d94,Security sucks,male,"Denver, United States",2023-10-19,NEGATIVO,0,0.39557776,0.38641217,0.053485487,0.049874675,0.04631469,0.06833522
07c1d21f-aeee-4833-a07e-15f6437e7515,"Tolong perbaharui font instagram story user android, karena jadi blur saat sudah di posting. Jadi susah upload kerjaan instagram story.",male,"Asunción, Paraguay",2024-12-13,NEGATIVO,2,0.034233943,0.042370763,0.8146563,0.032870747,0.030511316,0.045356985
410046e1-5b50-4d71-a76c-402139233edf,Dear friend don't wàste your valuable time ..,male,"Philadelphia, United States",2024-01-11,NEGATIVO,1,0.30297166,0.4770312,0.053968735,0.050325245,0.046727877,0.068975344
086ee688-ec24-43bc-a106-4de990ca1576,I like to use insta make me happy,male,"Lagos, Nigeria",2023-07-23,NEGATIVO,2,0.042059917,0.05209919,0.77241176,0.04037499,0.037510943,0.055543274
28758bcc-979e-4f25-88a8-c4630acc97ce,So many bugs😑😑😑,male,"Mombasa, Kenya",2022-12-29,NEGATIVO,1,0.039141744,0.79660517,0.040282257,0.037595183,0.034877732,0.051497895
2cfd5c8a-0a18-4a91-86ba-a7d26565da71,censoring,male,"Geneva, Switzerland",2021-09-27,NEGATIVO,0,0.64940023,0.07979968,0.066439345,0.061950978,0.05752534,0.084884435
fe7150f6-a7ad-4929-97f1-262262842ef0,🤬🤬🤬🤬🤬,male,"Addis Ababa, Ethiopia",2023-02-26,NEGATIVO,0,0.8085681,0.04355391,0.036279075,0.033827968,0.031411592,0.046359304
7d00fb33-9fb6-48b2-9d02-f4d58975a5ca,Very buggy. Upload something and it never posts but can't switch account because still uploading. Have to uninstall/reinstall app. Becoming more and more of an e-commerce app than anything else.,male,"Stockholm, Sweden",2021-10-16,NEGATIVO,0,0.483374,0.032190796,0.286157,0.14063543,0.023191648,0.034451097
f5a7cc6c-256b-4ea1-acb1-e0292d4c7a4a,Worst app..I just restricted my friend account but I can't unrestrict his account I was trying to unrestrict his account more than 1 hr..pls consider..this,female,"Perth, Australia",2025-12-02,NEGATIVO,1,0.03226618,0.83217394,0.033216473,0.030973848,0.028912697,0.042456895
c05762cf-fbad-4663-b6a2-09c5bbfefa04,"Instagram is becoming like a adult only website, now it is only for adult people. Wherever you look there is sexual pornography going on, if I report pornography account you don't take action against those accounts. Now Instagram is very harmful for age group below 18.",male,"Taipei, Taiwan",2022-04-04,NEGATIVO,0,0.8359724,0.03738305,0.031076532,0.028955638,0.026886156,0.03972621
dcdbf32f-adba-4a25-a9e2-2d64f1741369,Security flows,male,"Salvador, Brazil",2025-02-19,NEGATIVO,0,0.64945585,0.07974137,0.06643916,0.061953597,0.05752521,0.084884845
1aec8a63-3ded-4bc0-906a-3cf27d4b6168,Why the adds in reel 😑,female,"Christchurch, New Zealand",2025-06-05,NEGATIVO,3,0.03568041,0.044209573,0.036725193,0.8045882,0.031788446,0.04700812
3608a31c-c533-4640-b834-a88ee57da597,Me unhappy 🙁 not good app instagram 😕 but God know 👀,male,"Quito, Ecuador",2024-07-28,NEGATIVO,0,0.5833641,0.27289626,0.03524833,0.032864448,0.030516002,0.045110743
a8b77b15-858e-4666-ac40-74dfc325edb0,"Just another Tik tok, reels spoiled everything!!!",male,"Houston, United States",2024-01-12,NEGATIVO,2,0.04616987,0.3922022,0.41531336,0.04434698,0.041172393,0.06079519
d8796141-ad78-4094-b643-323c85ac50ae,This app has many glitches a popular creator liked my story But that are not showing,male,"Osaka, Japan",2022-03-01,NEGATIVO,1,0.038744558,0.7987239,0.03987116,0.037179176,0.034512047,0.050969113
4a6f197e-06d2-45e7-8702-7b8a438418bd,Adds in reels,male,"Accra, Ghana",2023-07-24,NEGATIVO,3,0.046448395,0.05743707,0.0478719,0.7456549,0.041420393,0.06116739
eb00ee10-bf86-4d35-b106-7ef97d878c0c,Time wasting,male,"Dakar, Senegal",2023-01-02,NEGATIVO,0,0.6493899,0.07978731,0.06643867,0.061952762,0.05752479,0.08490658
f15fd72f-03eb-4499-b85a-c325c936e58d,Instagram music are not available for my new account.. solve this solution abhishek.shaw120/and my old id was removed Instagram samy.shaw120. Please help me,male,"Tokyo, Japan",2022-06-16,NEGATIVO,2,0.02525975,0.031335536,0.86355966,0.024193404,0.02246616,0.03318546
055fa92d-3d56-465b-9d1f-5fdd6b98819d,Instagram me story'upload nhi ho rhi hai mere me Instagram kam nhi kr rha hai,male,"San Diego, United States",2024-02-19,NEGATIVO,4,0.038278587,0.047917187,0.039427187,0.03672293,0.78735113,0.05030303
b07c2b31-aea9-4a06-bd15-c69be38fa456,Really!! Adds in reels!!,male,"Phuket, Thailand",2022-11-08,NEGATIVO,3,0.041628662,0.05157288,0.042863093,0.772074,0.03709452,0.05476686
de5a0950-e84a-494c-ab4e-11dcfee0f98a,"Woowwww, it was a nightmare, got hacked, security? ",female,"Brisbane, Australia",2025-08-13,NEGATIVO,3,0.041266534,0.050803155,0.04232799,0.774856,0.036664747,0.05408166
a5e23531-b2ec-488f-a8ff-5dfb4ed6ed09,Bad security,female,"Port Moresby, Papua New Guinea",2025-08-02,NEGATIVO,0,0.7173693,0.06429127,0.053570993,0.04994999,0.04638034,0.06843813
e37fd63d-d1da-4a7b-84bf-44b9e9aad31b,Hacked,male,"Bali, Indonesia",2022-08-08,NEGATIVO,3,0.06449762,0.079741545,0.06644135,0.6469101,0.057525273,0.08488404
ea919fda-4b9e-4f80-b489-75968bdaff9e,It's a Excellent app & My Feb app I Luvvvv It,male,"Birmingham, United Kingdom",2021-12-07,NEGATIVO,1,0.06453516,0.6642811,0.06645458,0.061952766,0.057529747,0.08524661
3a2e896f-66d8-441c-a5c5-85c9a007cb67,The worst app ever Got hacked and there's no help in recovering it back,male,"Singapore, Singapore",2022-04-23,NEGATIVO,1,0.028972473,0.48103788,0.029826296,0.39619136,0.025833104,0.038138837
8d21aa7a-cdfb-4c44-9f13-97abfb34d196,This is the better aap.I am spending time 2 hours in a day.,male,"Jacksonville, United States",2023-09-17,NEGATIVO,1,0.041148018,0.7863149,0.042329524,0.039466634,0.036645703,0.05409524
4e51669b-bd2e-4fef-9818-651b59b0704c,Op,male,"Montevideo, Uruguay",2024-10-03,NEGATIVO,5,0.15539974,0.19213073,0.1600802,0.14926584,0.13860266,0.2045208
bca29cff-5546-4e57-850b-c1a3330d69cd,Not able to see my last posted stories in archive section of August. Please fix this. Still no response,male,"Guangzhou, China",2022-05-19,NEGATIVO,0,0.41293144,0.3899816,0.10948564,0.026504558,0.024597358,0.036499508
773aa501-d6d0-432e-9ff6-8f8681273f88,I am fed up with the disastrous algorithm choosing what I can see. I am fed up with Mr Zuckerberg choosing what historic images I am allowed to study.,male,"Tel Aviv, Israel",2022-07-24,NEGATIVO,0,0.7538889,0.055995964,0.046642855,0.043491963,0.04038443,0.059595924
3bd7c79e-317a-4580-b138-ea5b66bd983d,"Unable to download. Error message this shows is ""Error has occured on our end. Please try again!"". I have been trying to download app since May. Please assist",male,"Melbourne, Australia",2025-04-27,NEGATIVO,0,0.85654193,0.032847445,0.027108956,0.025241204,0.023431305,0.034829233
