reviewId,content,gender,location,date,score,cluster_id,prob_topico_0,prob_topico_1,prob_topico_2,prob_topico_3,prob_topico_4,prob_topico_5
48d7bac0-80b0-483c-9163-1646df7bef43,What bothers me is that my account got restricted without a clear reason. It makes the experience less enjoyable.,female,"Auckland, New Zealand",2025-10-02,NEGATIVO,4,0.02110923,0.026106436,0.021749405,0.02027663,0.6150775,0.29568073
bd3856a1-8704-4912-8955-06d864c38e58,"Personally, you need to pay to get visibility. It makes it harder to grow.",male,"Vienna, Austria",2021-06-20,NEGATIVO,2,0.024456447,0.03024721,0.86768585,0.023495967,0.021813165,0.032301363
b8d87c76-866a-40d3-9ea7-9480d4af4beb,"I wanted to like it, but it makes me compare myself too much. It makes it harder to grow.",male,"Córdoba, Argentina",2025-03-10,NEGATIVO,5,0.025157966,0.031107891,0.0259218,0.024162475,0.022434488,0.8712154
ac67731a-b270-40ab-a8e3-6013e98d134a,"So far, i keep seeing the same content repeatedly. That part could definitely be improved.",female,"Sydney, Australia",2025-05-13,NEGATIVO,5,0.023112524,0.02871391,0.023810295,0.022200828,0.42428014,0.47788227
4a552c81-2e2e-4e99-881b-7480a4de90a0,"For me, the app feels too complicated now. It makes the experience less enjoyable.",male,"Cape Town, South Africa",2023-06-09,NEGATIVO,5,0.025860025,0.03204116,0.026644269,0.024839776,0.023063924,0.86755085
e9939c8c-b63a-46d0-95d6-7b85e1e258ce,"In my experience, sometimes it feels hard to grow organically. It gets frustrating after a while.",male,"Seoul, South Korea",2022-08-06,NEGATIVO,3,0.024472032,0.14022608,0.02521812,0.7559588,0.021826314,0.03229857
d48e069f-362c-4e93-9fdc-88823b8d5b82,"So far, my posts barely reach anyone anymore. It ends up feeling repetitive.",male,"Asunción, Paraguay",2025-02-04,NEGATIVO,3,0.023061782,0.028552057,0.0237659,0.87364364,0.020570893,0.030405777
f640ed22-a4f4-4136-97ec-2b75a3015aa8,One issue is that it feels like everything is about Reels now.,male,"Dallas, United States",2023-08-12,NEGATIVO,2,0.027849864,0.03454344,0.5250679,0.026756333,0.34905547,0.036726937
0e097077-151f-450d-b649-7e604814f03d,"In my experience, i have followers but very little engagement. It slows things down.",male,"Manchester, United Kingdom",2022-01-15,NEGATIVO,5,0.027963165,0.03463203,0.26119134,0.026860233,0.024940671,0.6244126
b51e82a0-3e58-4e95-9b9e-c8433c08056b,I’d say there are too many bots and fake accounts. It ends up feeling repetitive.,female,"Christchurch, New Zealand",2025-09-01,NEGATIVO,1,0.024452962,0.8727571,0.02519971,0.023490354,0.021811828,0.03228806
dbebf81a-5ccf-462e-8c10-5daf1ec7a5ca,What bothers me is that my account got restricted without a clear reason. It makes it harder to grow.,female,"Perth, Australia",2025-07-10,NEGATIVO,4,0.022091787,0.02733,0.022770476,0.021229183,0.87731403,0.029264454
1a381c55-5fbd-4346-bc9f-94bbe655dee6,I’d say you need to pay to get visibility. It makes it harder to grow.,male,"Monterrey, Mexico",2023-09-04,NEGATIVO,2,0.024458412,0.030249348,0.86766684,0.023497745,0.021814775,0.032312825
dcee9b2c-e78a-41e5-bd6a-5fd7c5045228,"For me, it makes me compare myself too much. It makes the app harder to enjoy.",female,"Port Moresby, Papua New Guinea",2025-05-05,NEGATIVO,5,0.02670075,0.03301498,0.027502714,0.025640419,0.023809448,0.86333174
349cd4d3-5802-4d00-9249-1b29d3667ae0,"So far, i keep seeing the same content repeatedly. It makes the experience less enjoyable.",male,"Kumasi, Ghana",2023-05-05,NEGATIVO,5,0.023171913,0.028654102,0.023871971,0.02225763,0.020711424,0.881333
01027398-34ee-42d0-8ab9-3fbf523fcd92,One issue is that the app feels too complicated now.,male,"Santiago, Chile",2024-07-20,NEGATIVO,1,0.030488143,0.84139556,0.031408407,0.029287517,0.027193194,0.04022717
8ebe5872-c619-420e-9eca-74de2f326110,I’d say sometimes it feels hard to grow organically. It slows things down.,male,"Nairobi, Kenya",2023-03-31,NEGATIVO,3,0.02458695,0.35060787,0.025345145,0.5451113,0.02192903,0.032419678
b371432a-61ce-49bb-8634-7343499b0f31,What bothers me is that my posts barely reach anyone anymore. It makes it harder to grow.,male,"Houston, United States",2023-09-27,NEGATIVO,3,0.02312144,0.028590133,0.023824269,0.87330806,0.020622278,0.03053369
cbce43e7-65a2-4f51-a96d-ad76d4be5b2a,The main problem is that it feels like everything is about Reels now. It gets frustrating after a while.,male,"Manila, Philippines",2022-04-17,NEGATIVO,2,0.024491545,0.030305767,0.7069661,0.18406577,0.02184392,0.032326914
887267d5-64a9-495f-bf05-148a0fb970f3,"Personally, i have followers but very little engagement.",female,"Port Moresby, Papua New Guinea",2025-11-02,NEGATIVO,5,0.033316072,0.04120736,0.03432581,0.03200084,0.02971499,0.82943493
fa9e52fd-0a89-4245-a842-437d20c02570,"I wanted to like it, but there are too many bots and fake accounts.",male,"Tel Aviv, Israel",2022-10-09,NEGATIVO,1,0.027838752,0.8550063,0.028702332,0.026744453,0.02483202,0.036876146
3741c578-c09b-4e24-98e6-792cbd5516c0,The main problem is that my account got restricted without a clear reason. It makes it harder to grow.,male,"Munich, Germany",2021-11-25,NEGATIVO,4,0.021133268,0.026144786,0.021780709,0.020308148,0.8826448,0.02798828
022593d2-04f8-45b8-9339-5fe59672b627,"For me, you need to pay to get visibility. It ends up feeling repetitive.",male,"Glasgow, United Kingdom",2022-02-01,NEGATIVO,2,0.025743684,0.03186806,0.86076593,0.024731321,0.022963539,0.033927448
5f4fa9b0-9ed8-4679-b117-e2c32f021f8e,What bothers me is that it makes me compare myself too much. It makes it harder to grow.,male,"Berlin, Germany",2021-06-29,NEGATIVO,5,0.026867088,0.03321722,0.14544903,0.025804425,0.023958482,0.74470377
6fa71fa0-e783-4279-b454-98ce5a0ec672,"Honestly, i keep seeing the same content repeatedly. It makes the app harder to enjoy.",male,"Rio de Janeiro, Brazil",2024-09-12,NEGATIVO,5,0.023167793,0.028654028,0.023868447,0.022253228,0.020663125,0.88139343
a0cb5c4b-b110-47ce-8374-20caf917ac40,"In my experience, the app feels too complicated now.",male,"Chicago, United States",2024-01-03,NEGATIVO,1,0.033748813,0.82413006,0.03477606,0.032418974,0.030100008,0.04482614
02bde219-ebf6-4baa-9049-683b5a784457,One issue is that sometimes it feels hard to grow organically. It gets frustrating after a while.,male,"Santa Cruz, Bolivia",2025-01-22,NEGATIVO,3,0.023148675,0.028673591,0.023850368,0.87318265,0.020646451,0.030498276
6a9fc4dd-e83b-48d5-8f87-1464e1425721,The main problem is that my posts barely reach anyone anymore. It slows things down.,male,"Philadelphia, United States",2023-09-30,NEGATIVO,3,0.023068575,0.028570829,0.023779526,0.8736043,0.020574853,0.03040185
97a9743a-0a56-4a38-8c7b-bb6a85889a3f,"Honestly, it feels like everything is about Reels now. It gets frustrating after a while.",male,"Valparaíso, Chile",2025-01-17,NEGATIVO,2,0.026159098,0.03237964,0.85848725,0.025131594,0.023330567,0.034511805
ce991e98-01d2-4dcc-854c-2eba9bd652d8,The main problem is that i have followers but very little engagement. It gets frustrating after a while.,male,"São Paulo, Brazil",2024-08-10,NEGATIVO,5,0.025949929,0.032108095,0.026744977,0.024931835,0.023143254,0.86712193
d20fabfa-98f7-4d50-bbf4-98aeef7694cf,"In my experience, there are too many bots and fake accounts. It slows things down.",male,"Bogotá, Colombia",2024-12-25,NEGATIVO,1,0.02609701,0.864192,0.026892584,0.025067374,0.023276106,0.034474853
dca2a95b-6471-45cc-92df-6d53c05dbcf9,"So far, my account got restricted without a clear reason. It makes the experience less enjoyable.",male,"Lagos, Nigeria",2023-04-15,NEGATIVO,4,0.021177845,0.026196033,0.021820294,0.02034269,0.61060697,0.29985622
a02e8704-c974-4ec3-b222-c9b005d04ac4,"So far, you need to pay to get visibility. It ends up feeling repetitive.",male,"Seattle, United States",2024-05-21,NEGATIVO,2,0.024355873,0.03015247,0.86825925,0.023398248,0.021725401,0.0321088
9f289925-ca63-417f-a5ef-23f0ca46b6b8,The main problem is that it makes me compare myself too much. It makes the experience less enjoyable.,male,"Jeddah, Saudi Arabia",2022-04-01,NEGATIVO,5,0.023713997,0.029320624,0.024426837,0.02277549,0.021148274,0.87861484
340a76c3-30fc-4d71-96e9-77685908c181,"Honestly, i keep seeing the same content repeatedly. It makes it harder to grow.",male,"Lusaka, Zambia",2022-11-24,NEGATIVO,5,0.024408458,0.030185377,0.02514743,0.023447683,0.021770297,0.87504077
01f3ef17-3ce7-4477-99ac-b1f654f00aa7,"I wanted to like it, but the app feels too complicated now. It makes the app harder to enjoy.",male,"Lahore, Pakistan",2022-03-20,NEGATIVO,5,0.023826255,0.029541692,0.024556296,0.022886677,0.021250177,0.87793887
f672a644-7708-4d47-84c0-70dcc40a5a69,"So far, sometimes it feels hard to grow organically. It gets frustrating after a while.",male,"Mombasa, Kenya",2023-04-18,NEGATIVO,3,0.024434615,0.030252375,0.025178635,0.8661422,0.021793094,0.032198984
ae56f4f2-6787-4d78-a536-2a066d05213c,What bothers me is that my posts barely reach anyone anymore. It ends up feeling repetitive.,male,"Ho Chi Minh City, Vietnam",2022-07-13,NEGATIVO,3,0.023028864,0.028508527,0.023732483,0.87382555,0.02054197,0.030362554
c09ef017-ae8f-45fb-a0da-18aa45ecbcc0,The main problem is that it feels like everything is about Reels now.,male,"Tripoli, Libya",2023-04-15,NEGATIVO,2,0.027783636,0.034377657,0.66398406,0.21239331,0.024780897,0.03668042
2ffe41df-acd8-40a3-a409-d6102f6c0c96,"So far, i have followers but very little engagement. It ends up feeling repetitive.",female,"Queenstown, New Zealand",2025-11-19,NEGATIVO,5,0.02597474,0.032174725,0.026772447,0.024955334,0.023170969,0.86695176
6030b2ba-3e8a-47ee-8f10-4e84e984be8b,The main problem is that there are too many bots and fake accounts. It makes it harder to grow.,male,"Kampala, Uganda",2022-11-22,NEGATIVO,5,0.023219988,0.028864348,0.023921309,0.022305308,0.02070955,0.8809795
54a09d81-bc8d-435d-bae0-6678f1466683,"Personally, my account got restricted without a clear reason. That part could definitely be improved.",female,"Christchurch, New Zealand",2025-12-01,NEGATIVO,4,0.021056253,0.026078412,0.021691145,0.020224955,0.8832314,0.027717808
41ba132a-3634-423a-be8c-4866ff2eafd2,I’d say you need to pay to get visibility. It slows things down.,male,"Toronto, Canada",2024-05-02,NEGATIVO,2,0.025850305,0.031980775,0.8602402,0.024830053,0.023055863,0.03404276
e1a3fbb4-a586-4953-8afe-e606e7afee72,"I wanted to like it, but it makes me compare myself too much.",male,"Accra, Ghana",2023-02-21,NEGATIVO,5,0.030365918,0.037544332,0.03128495,0.029156994,0.027075132,0.84457266
54d92efc-0be0-4564-aac3-2c2cf69df23b,"I wanted to like it, but i keep seeing the same content repeatedly. It makes the app harder to enjoy.",female,"Melbourne, Australia",2025-05-07,NEGATIVO,5,0.022110607,0.02734701,0.022784337,0.02123825,0.019720485,0.88679934
40995d20-a2d4-4eda-8c57-c6f162eea98d,"For me, the app feels too complicated now. It makes the experience less enjoyable.",male,"Cancun, Mexico",2024-04-04,NEGATIVO,5,0.02586002,0.03204128,0.026644267,0.024839772,0.023063922,0.86755073
c97bd73d-83e0-4a1b-b0a8-3eea9ecb238a,"I wanted to like it, but sometimes it feels hard to grow organically. It gets frustrating after a while.",male,"Singapore, Singapore",2022-07-31,NEGATIVO,3,0.023125878,0.028631968,0.02383873,0.87326944,0.020626346,0.030507678
816bb557-0e3e-44c1-964c-3e47c1baced2,"In my experience, my posts barely reach anyone anymore. It makes it harder to grow.",male,"Rosario, Argentina",2025-01-19,NEGATIVO,3,0.0231879,0.02867434,0.023892727,0.8729067,0.020681432,0.03065692
90c2e429-678e-47f2-b4b7-a74493f1c2b5,"For me, it feels like everything is about Reels now. It gets frustrating after a while.",male,"Tripoli, Libya",2023-05-29,NEGATIVO,2,0.027800795,0.034395434,0.8496641,0.026709758,0.024794377,0.036635533
24e5d1a3-e202-4c61-9b38-d2b5ab44c9b8,One issue is that i have followers but very little engagement.,male,"Addis Ababa, Ethiopia",2023-01-23,NEGATIVO,5,0.030008707,0.037208684,0.030910352,0.028829552,0.026767397,0.8462753
42dbd781-d6ba-4a99-bacc-6e1e5d8b4429,"So far, there are too many bots and fake accounts.",male,"Harare, Zimbabwe",2022-12-08,NEGATIVO,1,0.03035538,0.8420872,0.031272545,0.029158069,0.02707419,0.040052667
9972d01e-0141-4a4d-bbe4-c2c379f7cfaa,"In my experience, my account got restricted without a clear reason. It slows things down.",male,"Valparaíso, Chile",2024-08-12,NEGATIVO,4,0.02317064,0.028690793,0.023881627,0.022257144,0.87139726,0.030602574
fd0bbb6a-c4d2-4bc1-b7aa-fb94f51f61fa,"For me, you need to pay to get visibility. It slows things down.",male,"Ho Chi Minh City, Vietnam",2022-08-28,NEGATIVO,2,0.027575394,0.034114413,0.85092694,0.026487328,0.024594603,0.036301356
62ea1f97-7bf6-41ce-8bdb-2faf8a8729e0,"Honestly, it makes me compare myself too much. That part could definitely be improved.",male,"Fortaleza, Brazil",2025-02-13,NEGATIVO,4,0.02447392,0.030366408,0.025206245,0.023501232,0.64298826,0.25346395
58513df3-adf2-4d81-96d3-c716e1492959,"For me, i keep seeing the same content repeatedly. It makes it harder to grow.",male,"Chennai, India",2022-10-11,NEGATIVO,5,0.025805762,0.031908788,0.026587214,0.024790468,0.023016583,0.86789113
9193a62d-63c4-43ba-a9e0-173f8544441d,"Honestly, the app feels too complicated now. It makes the experience less enjoyable.",male,"New York, United States",2023-11-30,NEGATIVO,5,0.024569739,0.03046338,0.025314458,0.02360042,0.021913322,0.87413865
f5c4fc00-9052-493d-8eb7-e4a4cbd235ef,The main problem is that sometimes it feels hard to grow organically.,male,"Ottawa, Canada",2023-08-29,NEGATIVO,3,0.02596707,0.032147065,0.0267537,0.85774845,0.023160199,0.034223493
6a7a1cd9-c475-47f7-b774-a75bbcb36a91,What bothers me is that my posts barely reach anyone anymore.,female,"Queenstown, New Zealand",2025-05-03,NEGATIVO,3,0.027604105,0.034133386,0.028438235,0.8488473,0.024620282,0.0363567
b102900b-96c3-407d-a8f5-a9911c3d2173,"For me, it feels like everything is about Reels now. It makes the app harder to enjoy.",female,"Port Moresby, Papua New Guinea",2025-06-27,NEGATIVO,2,0.024368027,0.030159183,0.86805207,0.023405666,0.02173206,0.032283023
12c15eaa-6803-4727-a325-38cd435eed62,"Personally, i have followers but very little engagement. That part could definitely be improved.",male,"Jeddah, Saudi Arabia",2022-04-09,NEGATIVO,1,0.024403147,0.49630922,0.025140582,0.02343981,0.021769192,0.40893805
54f5d85a-cf71-4be3-80cc-b973c077f702,"Personally, there are too many bots and fake accounts.",male,"Denver, United States",2024-02-07,NEGATIVO,1,0.030227723,0.84277314,0.031141771,0.029033512,0.026960082,0.039863784
0ecb7dfc-833d-429a-9ed4-2069b96d9941,"Personally, my account got restricted without a clear reason. It gets frustrating after a while.",female,"Sydney, Australia",2025-07-14,NEGATIVO,4,0.02322709,0.02876023,0.02395182,0.02231882,0.8710936,0.030648403
1cafec5d-e02a-4b6b-8cc6-292bc471b345,"In my experience, you need to pay to get visibility. That part could definitely be improved.",male,"Lagos, Nigeria",2023-06-20,NEGATIVO,2,0.023191633,0.3712816,0.53199685,0.022276735,0.020689525,0.030563682
4f63cd0c-34f1-47c6-94d6-25f5629200b4,"Honestly, it makes me compare myself too much. It makes the experience less enjoyable.",female,"Adelaide, Australia",2025-08-22,NEGATIVO,5,0.025013912,0.03092688,0.025764294,0.024021832,0.022306502,0.87196654
f65191da-c562-468e-9678-1c9a0d62e5b8,The main problem is that i keep seeing the same content repeatedly. It ends up feeling repetitive.,male,"Tel Aviv, Israel",2022-09-14,NEGATIVO,5,0.023109337,0.028614657,0.023816183,0.022202035,0.02061389,0.8816439
a9ed117e-3cba-496d-8413-7feaccb7a69d,"For me, the app feels too complicated now. That part could definitely be improved.",male,"Chicago, United States",2024-03-17,NEGATIVO,1,0.025875421,0.86543614,0.026656441,0.024854206,0.023081247,0.03409665
485f8242-f087-4d92-8af0-26ac3f4f786a,"Honestly, sometimes it feels hard to grow organically. It ends up feeling repetitive.",male,"Los Angeles, United States",2024-07-18,NEGATIVO,1,0.023151569,0.4777366,0.023860656,0.42405158,0.020651551,0.030548075
abccb9e2-91e0-4d6a-afaf-d185310ebbde,The main problem is that my posts barely reach anyone anymore. It gets frustrating after a while.,male,"Bangkok, Thailand",2022-06-21,NEGATIVO,3,0.023102893,0.028572982,0.023803055,0.8734759,0.020604942,0.030440195
baf4f46d-60e0-4d99-be13-1059d2d5039e,"I wanted to like it, but it feels like everything is about Reels now. It makes the app harder to enjoy.",male,"Oslo, Norway",2021-06-28,NEGATIVO,2,0.022869956,0.028302668,0.87618583,0.021967899,0.020397054,0.030276556
2b10a6a0-bea3-4b0b-b581-a9796c12b3f2,"So far, i have followers but very little engagement. It makes the app harder to enjoy.",male,"Pretoria, South Africa",2023-05-02,NEGATIVO,5,0.024595644,0.030421646,0.025340972,0.023625273,0.021936703,0.8740798
2fe7a01b-8427-4d70-b585-65b787e8024a,"So far, there are too many bots and fake accounts. It makes the experience less enjoyable.",female,"Suva, Fiji",2025-09-19,NEGATIVO,5,0.023262326,0.028961195,0.02396294,0.02234286,0.020747276,0.88072336
7868326a-9dc5-461f-8e83-661c0c674843,"Personally, my account got restricted without a clear reason. It makes the app harder to enjoy.",male,"Tunis, Tunisia",2022-12-30,NEGATIVO,4,0.02117289,0.026194682,0.021827374,0.020338802,0.8822466,0.028219648
54960503-d727-4001-8e55-e1a9d8bfac29,"For me, you need to pay to get visibility.",male,"Montevideo, Uruguay",2024-12-28,NEGATIVO,2,0.03295446,0.040746942,0.82187784,0.031653978,0.029392023,0.043374874
fe9bde3f-cda8-4b79-9df0-13ed4e93ad92,"For me, it makes me compare myself too much. It makes the app harder to enjoy.",male,"Hong Kong, China",2022-03-24,NEGATIVO,5,0.026700797,0.03301498,0.027502714,0.025640419,0.023809448,0.8633316
4fb79a27-c5ce-4e2d-85d9-f3e4965eb00e,The main problem is that i keep seeing the same content repeatedly. That part could definitely be improved.,male,"Algiers, Algeria",2022-12-28,NEGATIVO,5,0.022015486,0.34100565,0.022680044,0.021148022,0.019640222,0.5735106
6381dd9e-3d4b-4ffd-9e2e-500cc737cb23,"In my experience, the app feels too complicated now. It makes the experience less enjoyable.",male,"Dublin, Ireland",2022-02-01,NEGATIVO,5,0.025490586,0.031588413,0.026263108,0.024484936,0.022734586,0.8694384
47cf8a1a-9791-45c7-9cf8-061c80e20796,What bothers me is that sometimes it feels hard to grow organically. It gets frustrating after a while.,male,"Arequipa, Peru",2024-09-14,NEGATIVO,3,0.024507433,0.030341955,0.02525369,0.8657449,0.021858124,0.032293994
d8bf24d1-fb07-4965-835a-0f1e48790990,"Honestly, my posts barely reach anyone anymore. It ends up feeling repetitive.",male,"Rosario, Argentina",2024-08-15,NEGATIVO,3,0.023117462,0.028647518,0.02382536,0.87324506,0.020620916,0.030543651
683df06c-df80-4b8c-bd80-5507326eb352,What bothers me is that it feels like everything is about Reels now. It ends up feeling repetitive.,male,"Rosario, Argentina",2024-07-28,NEGATIVO,2,0.024565225,0.03041082,0.867124,0.023599695,0.021912094,0.032388065
a397c153-699d-4155-8287-8048d929d784,I’d say i have followers but very little engagement. It makes the experience less enjoyable.,male,"Lahore, Pakistan",2022-08-02,NEGATIVO,5,0.02455183,0.030118622,0.02514216,0.023395456,0.021724004,0.87506795
c0fc915d-42fe-4065-87b6-fe6c6893f039,"I wanted to like it, but there are too many bots and fake accounts.",male,"Caracas, Venezuela",2024-08-04,NEGATIVO,1,0.027838754,0.8550102,0.02870233,0.026744455,0.024832021,0.036872286
2ce94de2-d923-44d1-bf58-dfabf3666a2a,"So far, my account got restricted without a clear reason. It gets frustrating after a while.",male,"Tokyo, Japan",2022-06-19,NEGATIVO,4,0.023300804,0.028866537,0.024031352,0.02239189,0.8706237,0.030785693
c9c4896d-0829-4713-9190-65812caf0dec,"So far, you need to pay to get visibility. It slows things down.",male,"Kumasi, Ghana",2023-05-15,NEGATIVO,2,0.025884507,0.032026622,0.8600453,0.024863994,0.023086665,0.03409282
c17fd8fb-9659-4221-86ca-2141e6858cf0,"I wanted to like it, but it makes me compare myself too much. It makes the app harder to enjoy.",male,"Rabat, Morocco",2023-02-16,NEGATIVO,5,0.023807067,0.029441243,0.024529107,0.022862904,0.021229738,0.87812996
699d64a4-bec8-494e-a394-97b0093c54d3,The main problem is that i keep seeing the same content repeatedly.,male,"Rabat, Morocco",2023-01-19,NEGATIVO,5,0.027677538,0.034228254,0.028513338,0.02658731,0.024685483,0.8583081
a0adf3c8-d7fe-402c-adfa-d4ba7ec8251d,I’d say the app feels too complicated now. It makes the app harder to enjoy.,male,"Marseille, France",2021-09-09,NEGATIVO,5,0.025357807,0.031436797,0.026128897,0.024356961,0.022615567,0.87010396
7d7e8dfa-8cda-4f3f-bad0-14eb7d43e95c,"I wanted to like it, but sometimes it feels hard to grow organically. It gets frustrating after a while.",male,"Los Angeles, United States",2024-04-25,NEGATIVO,3,0.02312588,0.028634565,0.02384008,0.873265,0.020626348,0.030508187
dfe00b54-8895-4e29-88f8-4ec1d960f24c,What bothers me is that my posts barely reach anyone anymore. It makes the app harder to enjoy.,male,"Salvador, Brazil",2024-08-29,NEGATIVO,3,0.022071986,0.02734521,0.02275131,0.8786982,0.01968244,0.029450838
5536e65a-cb0e-426f-9c01-578fdc0247e6,The main problem is that it feels like everything is about Reels now. It makes it harder to grow.,male,"Calgary, Canada",2024-03-25,NEGATIVO,2,0.02319,0.02868954,0.72989905,0.16686063,0.020684034,0.030676678
c56a9475-f057-45de-8c41-672ec5d0c1a3,"For me, i have followers but very little engagement. It makes the app harder to enjoy.",male,"Ottawa, Canada",2024-05-22,NEGATIVO,5,0.025828104,0.031942535,0.026610116,0.02480847,0.023035718,0.8677751
96edc10f-e6cb-4574-aafe-283d6fd844d2,"I wanted to like it, but there are too many bots and fake accounts. It slows things down.",male,"Jakarta, Indonesia",2022-03-16,NEGATIVO,1,0.024517816,0.8723585,0.025278406,0.023553139,0.021869192,0.032423045
18031b44-4e30-4c4e-a854-9421ed8ab3b1,One issue is that my account got restricted without a clear reason. It slows things down.,male,"Rome, Italy",2022-02-10,NEGATIVO,4,0.022003623,0.027249629,0.022674413,0.02113585,0.8779581,0.028978461
f5fbe1c1-9d26-4848-b875-3157331aae2b,What bothers me is that you need to pay to get visibility. It slows things down.,male,"Los Angeles, United States",2023-10-11,NEGATIVO,2,0.025994234,0.03215749,0.85945904,0.024969317,0.023184603,0.034235377
23bc4f4a-4a55-4fa5-a5aa-455bd901a92b,One issue is that it makes me compare myself too much.,female,"Wellington, New Zealand",2025-06-05,NEGATIVO,5,0.030393045,0.31754464,0.031291254,0.029182801,0.027098995,0.5644893
9722b121-2e79-4194-9984-7afc38fb3694,"I wanted to like it, but i keep seeing the same content repeatedly. It gets frustrating after a while.",male,"Manila, Philippines",2022-04-08,NEGATIVO,5,0.024423543,0.030217055,0.025175968,0.02346354,0.021782558,0.8749373
be67fe68-3909-4745-a5f7-f459855af3cf,"So far, the app feels too complicated now. It makes the experience less enjoyable.",male,"Kampala, Uganda",2023-07-18,NEGATIVO,5,0.024497118,0.030369971,0.025240684,0.023531158,0.021848625,0.87451243
d05753e1-35a3-4595-b26b-ecca66267602,"For me, sometimes it feels hard to grow organically. It ends up feeling repetitive.",male,"Nairobi, Kenya",2023-05-22,NEGATIVO,3,0.024316702,0.19061784,0.02506289,0.7062431,0.021691456,0.03206809
07d292a4-32e2-485c-88d9-c697a33e8369,What bothers me is that my posts barely reach anyone anymore. It makes it harder to grow.,male,"Boston, United States",2023-09-13,NEGATIVO,3,0.02312144,0.028590133,0.023824269,0.8733085,0.020622278,0.030533312
46a218fd-b18e-4211-a016-9cd0520bca23,"Personally, it feels like everything is about Reels now. It makes it harder to grow.",male,"Shanghai, China",2022-03-02,NEGATIVO,2,0.024620026,0.030454654,0.8667927,0.023653634,0.021958992,0.032520052
6512d7b6-555f-443c-9050-2ab2ffd968f6,One issue is that i have followers but very little engagement. It makes it harder to grow.,male,"Tripoli, Libya",2022-12-29,NEGATIVO,5,0.024411747,0.030237919,0.025149385,0.023453668,0.021774499,0.8749728
97d0d221-7b33-4edd-b2e5-49b64d8f5f1a,I’d say there are too many bots and fake accounts. It makes the app harder to enjoy.,male,"Hong Kong, China",2022-08-16,NEGATIVO,5,0.023253147,0.028929267,0.023954662,0.022333246,0.020738542,0.8807912
3af15400-11a7-44ac-943e-bbeff0b34726,"I wanted to like it, but my account got restricted without a clear reason.",female,"Christchurch, New Zealand",2025-04-15,NEGATIVO,4,0.024307445,0.030066349,0.025048822,0.023349049,0.8651851,0.03204324
30310f82-31a3-4395-ab17-7eba36b0aeb9,"So far, you need to pay to get visibility. It slows things down.",male,"Caracas, Venezuela",2022-06-02,NEGATIVO,2,0.025884511,0.03202655,0.86004543,0.024863996,0.023086667,0.034092784
87ad912d-a8c3-45fa-8a19-818625bd1225,"So far, it makes me compare myself too much. It makes the experience less enjoyable.",male,"Durban, South Africa",2020-09-16,NEGATIVO,5,0.025143621,0.031086698,0.025898365,0.024146577,0.022421952,0.8713028
f6a3f2ae-e7c2-430f-843f-b2cc779a754b,"For me, i keep seeing the same content repeatedly. That part could definitely be improved.",male,"Denver, United States",2021-07-15,NEGATIVO,5,0.024235202,0.40247655,0.024964979,0.023278382,0.021620836,0.5034241
b4c9f740-3af2-44c3-89b2-88a833c46df2,"In my experience, the app feels too complicated now. It makes the experience less enjoyable.",male,"Krakow, Poland",2019-06-05,NEGATIVO,5,0.025490582,0.031588066,0.026263105,0.024484932,0.022734584,0.8694387
2a4182b9-f3f7-4634-b3e7-1638a72637c9,One issue is that sometimes it feels hard to grow organically. That part could definitely be improved.,male,"Houston, United States",2021-02-02,NEGATIVO,1,0.021158468,0.66512424,0.02179705,0.24518135,0.018873585,0.027865378
6cb747f5-db2e-4433-8824-40ede1e3b185,The main problem is that my posts barely reach anyone anymore. It slows things down.,male,"Seoul, South Korea",2020-02-13,NEGATIVO,3,0.023068575,0.028570842,0.023779664,0.87360424,0.020574853,0.030401845
