reviewId,content,gender,location,date,score,cluster_id,prob_topico_0,prob_topico_1,prob_topico_2,prob_topico_3,prob_topico_4,prob_topico_5
bb7ba2f7-c5f0-4d27-8fa5-eed0240e11d0,"Reels are uploaded upside down. This sucks, i tried reinstalling, clearing cache, clearing data. Have done everything possible. This is worse. In world so focused on reels it's frustrating to see this not working out.",male,"Berlin, Germany",2021-07-06,NEGATIVO,1,0.12687282,0.7707336,0.025232382,0.023378843,0.021691993,0.03209045
cc516a40-5e71-4f87-8d72-b4717cee20c1,THIS APP IS HELPFULL... But MY VIDEO IS NOT VIRAL NOT A TRENDING WHY?,male,"Frankfurt, Germany",2021-09-24,NEGATIVO,1,0.047036536,0.75542814,0.048452,0.04519495,0.041948903,0.06193936
302d2dfa-0c7d-454f-a75d-eb305db43134,"Nice, but problems uploading reels",male,"Kampala, Uganda",2023-07-11,NEGATIVO,5,0.041956864,0.051905606,0.04326274,0.040295642,0.03740869,0.78517044
0e0b55d2-82a9-44da-ae66-0d501999a510,"In questo periodo da molti problemi, sopratutto per quanto riguarda le storie",male,"Athens, Greece",2021-12-11,NEGATIVO,5,0.15539974,0.19213073,0.1600802,0.14926584,0.13860266,0.2045208
440670b5-d821-430c-b6e0-68153499ce2a,Shaad Khokar,male,"Stockholm, Sweden",2021-07-21,NEGATIVO,5,0.15539974,0.19213073,0.1600802,0.14926584,0.13860266,0.2045208
b0ef330c-de7b-497a-880d-e8efe364cb30,"go easy on the ads, i want to see the post from people/pages that i actually follow, i don't want to look at any ad everytime i scroll pass just 1 post.",male,"Buenos Aires, Argentina",2024-11-16,NEGATIVO,0,0.85146713,0.033794884,0.02812936,0.026240641,0.024356248,0.036011703
f90ad7ac-481d-4a9c-aac3-b0c17449c17e,I barely downloaded the app and made an account. Didn't Didn't get to feed or anything after i pressed make account or somthing it automatically suspended me????,male,"Dakar, Senegal",2023-03-26,NEGATIVO,3,0.029637357,0.43046165,0.030538775,0.44377542,0.026430024,0.03915678
3e7ba973-5abe-4925-98ea-c88bc3b62e50,Not open this app please help me 😞,male,"La Paz, Bolivia",2024-11-03,NEGATIVO,0,0.55341154,0.044136144,0.28964838,0.034191273,0.031733047,0.046879582
bef75575-15ec-49fe-b17e-9ec626f267a8,This app is suck girls like this app but they want flex cars house girls our suck like this app,male,"Durban, South Africa",2023-06-30,NEGATIVO,1,0.038769346,0.7982763,0.03997075,0.03723292,0.03457344,0.05117719
1ae81087-1648-4002-890d-668b6429e129,Profile pic Ravadam ledhu,male,"Accra, Ghana",2023-06-26,NEGATIVO,0,0.6494494,0.079743385,0.066442885,0.061952107,0.057526384,0.08488579
2108db39-4feb-45bd-aa2a-12a3c82851f3,Editing is not perfect becouse I use editing my video some issues with edit,male,"Boston, United States",2023-08-12,NEGATIVO,1,0.040720213,0.7882923,0.041947246,0.039114494,0.03632163,0.05360412
3826daef-22fb-44c7-b08b-004e5b85f359,Awesome but crashes frequently,male,"Durban, South Africa",2023-08-05,NEGATIVO,5,0.040784743,0.050565578,0.041972656,0.039137557,0.036352668,0.7911868
afe9942d-6588-483a-b03b-00221f84518b,Suddenly reels have become so annoying... I get 4-5 ads after every 2-3 reels which just pisses me off.. i would love to uninstall this app if it is isn't fixed soon enough,male,"Guayaquil, Ecuador",2025-02-05,NEGATIVO,1,0.33853543,0.5554305,0.026026996,0.024246207,0.02251214,0.033248916
bfc40d45-8dd7-4d97-8096-ba1f551f9bad,The man behind the Slaughter...,male,"Harare, Zimbabwe",2023-04-08,NEGATIVO,1,0.06450164,0.66468716,0.066442095,0.061953504,0.05752767,0.08488783
fdf93aec-7389-44f4-adf7-0ea63418252e,Third class app very poor,female,"Hobart, Australia",2025-07-24,NEGATIVO,5,0.05483754,0.0679323,0.056479942,0.05265965,0.048898805,0.7191917
86afeff1-6c9f-4b76-be9f-70bd148292bc,Not good service Intergram,male,"Frankfurt, Germany",2021-08-06,NEGATIVO,2,0.31685108,0.06498657,0.4517395,0.05045004,0.046846673,0.06912613
3ec345bf-ff42-481f-a7fb-67bb143c2806,My Instagram account has freeze ❄️please solve this problem,male,"Rosario, Argentina",2024-12-18,NEGATIVO,3,0.03195967,0.039650537,0.03291603,0.8249496,0.028472358,0.042051774
487fb6e6-e9fc-4b99-997c-25f7a8034022,Ok but poor user support ,male,"Krakow, Poland",2022-01-01,NEGATIVO,4,0.037504096,0.046365984,0.03863567,0.03602163,0.44536668,0.39610592
c8d6e299-3ef3-4b06-8723-00fbab4439b9,زربه,male,"Houston, United States",2024-04-03,NEGATIVO,5,0.15539974,0.19213073,0.1600802,0.14926584,0.13860266,0.2045208
1d7337aa-e2a9-4f90-9a69-910407e6c5a0,It banned. Me,male,"Manchester, United Kingdom",2021-06-22,NEGATIVO,3,0.064498544,0.07976053,0.066441156,0.64688635,0.05752687,0.08488653
64f20569-7f63-4084-a934-a4a2f63a32f9,slow chlta hai,male,"San Francisco, United States",2023-11-21,NEGATIVO,0,0.4297582,0.064378984,0.053659193,0.05001302,0.3336651,0.06852548
36648a1a-84e8-4532-93ce-ceb0571209b8,Bekar sa app hai koi ladki reply tak ni karti na hi MSG seen hota hai Faltu hai bilkul,male,"Stockholm, Sweden",2021-06-10,NEGATIVO,4,0.02950334,0.22724307,0.03040834,0.23285459,0.44109628,0.03889441
b49bb517-54ed-4a21-afb2-5831fa39d7da,I have no effect,female,"Hobart, Australia",2025-10-10,NEGATIVO,5,0.15539974,0.19213073,0.1600802,0.14926584,0.13860266,0.2045208
8271f684-bba1-4e37-8fc8-64926c3c83b8,"Without counting the useless algorithm copied from TikTok, Instagram doesn't allow me on keep editing my captions.I reinstalled the app and nothing",female,"Perth, Australia",2025-07-26,NEGATIVO,4,0.4276311,0.038116872,0.031530023,0.029402914,0.43189383,0.041425265
29b3af24-e3e3-4c2c-ac34-114dafdac259,Security issues,male,"Fortaleza, Brazil",2025-01-24,NEGATIVO,0,0.7127134,0.06551535,0.054379,0.050712794,0.047084972,0.06959445
050b6004-7efe-4b24-a7eb-90ea2e5e7d5d,لم يصل الي تحديث المرسلات 😒,female,"Nadi, Fiji",2025-08-11,NEGATIVO,4,0.0456932,0.05654647,0.047047675,0.04386773,0.746676,0.06016884
af9e8c37-96b9-4e60-a685-1559606f94d9,It was all good till today..... today when i updated the app... I'm not able to react on messages... cannot even mention a message to which I'm replying...till today i was able to do these things...but after update it's all 👎👎 and also most of the audios on reels or stories are unavailable for me...🙄 Please solve these problems,male,"Seville, Spain",2022-02-03,NEGATIVO,0,0.8853227,0.026102155,0.021734007,0.020259382,0.018808221,0.027773585
adef4c7e-08cc-49ad-8fa2-2f42e81a76db,we're sorry but something went wrong try again how many should i try again?? reels are not in the reels section,male,"Athens, Greece",2022-02-23,NEGATIVO,2,0.23661686,0.03372307,0.64384955,0.025981408,0.024123259,0.035705805
51804b17-9582-434a-a3e7-9e73a66b3ded,In there instagram some problems the camera are not working in this instagram when I am opening instagram story and reels makin video the camera are not supported that will show black screen,male,"Dubai, United Arab Emirates",2022-04-14,NEGATIVO,0,0.5405815,0.035142474,0.029234052,0.3324072,0.025292644,0.03734217
8fdee055-a646-4b74-9894-ef993cd49cfd,My account got hacked,male,"New York, United States",2024-04-09,NEGATIVO,3,0.038352218,0.047459364,0.039503496,0.46334642,0.36085317,0.050485387
1c077a6e-7b9f-4e4b-ab61-b840c201ff2c,I face so many problems to login,female,"Brisbane, Australia",2025-07-26,NEGATIVO,1,0.041684147,0.7832292,0.042927947,0.04002645,0.037161257,0.054971017
07662366-7736-4006-92d8-45160b3d5006,very bad app. Any post about certain topics gets removed or limited. It’s obvious they’re censoring opinions.,female,"Canberra, Australia",2025-12-14,NEGATIVO,0,0.78904825,0.048023064,0.039981954,0.0372589,0.03457594,0.05111189
bb95cefd-007c-44e6-8039-2817710803f7,"Bad, terrible logging",male,"La Paz, Bolivia",2024-09-04,NEGATIVO,2,0.04541022,0.056059536,0.7548384,0.043546338,0.040433854,0.05971172
4990842d-3b85-48de-a1b0-ed269a618be8,Poulas petrus😎,male,"Caracas, Venezuela",2024-10-09,NEGATIVO,5,0.04565438,0.056513056,0.046992566,0.04381566,0.040687796,0.76633656
7d4b6806-3a79-4c2e-a14a-423bc73bfd63,Worst app because my girlfriend blocked me in Instagram please first delete the option of blocking in Instagram,female,"Auckland, New Zealand",2025-08-01,NEGATIVO,1,0.029120885,0.590093,0.28856292,0.02795617,0.025955338,0.0383117
c8b0ec34-e58c-44a7-ad98-a7bf2f8cf0fe,Turning into Tiktok,male,"Durban, South Africa",2023-04-05,NEGATIVO,5,0.06450112,0.07993078,0.06644282,0.061962817,0.057531815,0.66963065
0f21cbd2-8ec7-412d-a328-c17a22d563ef,My music section not showing Hindi and panjabi sangs only work for English song please Hindi and panjabi sangs my insta account help,male,"Singapore, Singapore",2022-07-27,NEGATIVO,0,0.6153612,0.25608385,0.031602085,0.02939598,0.027288558,0.04026838
ab59cbad-081a-4b50-afea-fec447da7794,Hello! 🙏🙏🙏 Please my solve problems.. 🙏🙏🙏 Name ni rkh ho reha mera problem solve kroo.. 🙏🙏🙏🙏 Instagram don't keep my name. 🙏🙏🙏🙏 Please solve the problem 🙏🙏🙏🙏🙏🙏🙏🙏🙏🙏🙏🙏🙏🙏🙏🙏🙏🙏🙏🙏🙏🙏🙏🙏🙏🙏🙏🙏🙏🙏🙏🙏🙏🙏🙏🙏🙏,male,"Manila, Philippines",2022-03-22,NEGATIVO,3,0.038600214,0.047924384,0.03971475,0.7869813,0.03436932,0.052410033
0eb6ab14-4e4e-4d43-99ac-654fdcf26f6c,INSTAGRAMDA ANASAYFAM YENİLENMİYOR VE HİÇBİR ŞEY AÇILMIYOR.Üste çıksın diye random atıyorum. DJSJSJDJSJSJDJDJDSJJSDJSJSJDJDJSNDNSKSDNDKDNDNDJDJDNDNDNDNDNDNDNDBDBDNDBDNDNDNRBDNDDJDDJDJDJDJJDJDJDDKKDEKKDKFKDKEEKEKFKRJJRDJKFJFKEFKFJKRFJFJRKJF,male,"Budapest, Hungary",2021-12-21,NEGATIVO,5,0.064501405,0.079747625,0.06644392,0.06195518,0.057535373,0.66981655
403688b4-2324-4645-9787-dcb310c62cd6,No information from the user.,male,"Medellín, Colombia",2025-02-21,NEGATIVO,4,0.06449722,0.07974257,0.06647379,0.061951376,0.64223605,0.08509903
7bb6c32c-bde6-40d6-a0d7-2cd698663e63,Update ho gya he,male,"Geneva, Switzerland",2022-02-05,NEGATIVO,1,0.052387774,0.72730273,0.053967115,0.05026529,0.04667589,0.06940116
416992cf-64b5-44a0-89a3-ed4e7f9c12c7,Nonsense and useless app....har barr temporary blocked aa raha hee..,male,"Bangkok, Thailand",2022-08-20,NEGATIVO,4,0.038476843,0.04794191,0.039629843,0.036949884,0.78630584,0.05069565
639e2760-c86a-41b8-a1b6-0c9fccf979a1,please help me below mentioned message showing in 2 days we are sorry but something went wrong instagram,male,"Bogotá, Colombia",2025-03-03,NEGATIVO,2,0.025004122,0.03099222,0.86480665,0.02400953,0.022291884,0.032895673
b928bf6d-728e-4b50-ad85-49a1d92e0b9b,Too many thieves,male,"Manila, Philippines",2022-11-06,NEGATIVO,1,0.06450437,0.6645529,0.06643866,0.06195278,0.05752473,0.08502667
d3049288-026d-414d-887b-de76bd468722,Too many questions,female,"Suva, Fiji",2025-12-01,NEGATIVO,1,0.06450437,0.66455203,0.06643866,0.061952777,0.057524726,0.085027546
250cbd66-d638-41ba-99f2-f06fadd58565,It's some time say error i hate it,male,"Ho Chi Minh City, Vietnam",2022-08-24,NEGATIVO,0,0.7934283,0.047039542,0.03911664,0.036459193,0.03385462,0.05010173
22d72cb2-1387-4606-9faf-d4c89d52fd5d,It's experiencing crashes,male,"Tijuana, Mexico",2023-11-13,NEGATIVO,5,0.06449832,0.079743825,0.06644092,0.06195616,0.057526674,0.6698341
8bf0db9d-ab9d-435f-8a1a-7f1808a6f290,Loggin issues,male,"Delhi, India",2022-11-12,NEGATIVO,1,0.06452616,0.66443,0.06645093,0.061971366,0.057538267,0.08508336
c85d86d8-d146-4a5b-a5a6-a36674c84a55,"I can't put Malayalam,Tamil,hindi lanaguge songs on story",female,"Gold Coast, Australia",2025-08-04,NEGATIVO,0,0.77678907,0.050781533,0.04230791,0.039449327,0.036625493,0.054046664
11392dcf-6941-4fba-9335-544e2d0008d0,Very bad experience and I got hacked!!,male,"Cairo, Egypt",2023-02-07,NEGATIVO,3,0.03569371,0.044107106,0.28832176,0.55298775,0.031798538,0.04709109
024b0bf6-6695-4f4d-acf2-3f79467b6eee,When will you fix your forward msg showing random account's instead of frequently contacted ones?!,male,"Durban, South Africa",2023-05-30,NEGATIVO,4,0.03183051,0.039665323,0.032788094,0.030575935,0.8230892,0.04205102
7101fa65-bc10-44ea-92f2-6105c0f66eeb,It is easy to get you access stole,male,"Jacksonville, United States",2023-10-08,NEGATIVO,2,0.36448103,0.057814296,0.4304114,0.04465067,0.041458074,0.06118448
f3731b02-db40-48fb-a09d-d3afa6a82c9c,Banned me,female,"Nadi, Fiji",2025-09-19,NEGATIVO,3,0.064498544,0.07976062,0.066441156,0.6468863,0.05752687,0.08488653
89cf232f-3f58-4d85-a2ff-2a8752b97e88,Video reel sering membeku di tengah waktu,male,"Rome, Italy",2021-07-27,NEGATIVO,3,0.052860677,0.06549747,0.054511134,0.7103372,0.047135413,0.06965808
bf56c735-1a4e-4950-8d9f-fefce8ff00ba,when I follow a person it won't stay followed.,male,"Arequipa, Peru",2024-09-14,NEGATIVO,4,0.052061252,0.06434161,0.053607903,0.049986333,0.7115122,0.068490714
6f30fbb6-e2c3-4447-be2a-3f777caa1dc8,My I'd is blocked for Instagram Help me Coconut them,female,"Canberra, Australia",2025-07-02,NEGATIVO,1,0.045791563,0.7620032,0.04716722,0.043971233,0.040823698,0.060243033
1eef2e9b-4e14-4141-9471-79a92bec6ec0,This is the worst application in the Google Play Store. So many updates come. And nothing change.,male,"Krakow, Poland",2021-07-21,NEGATIVO,0,0.8285567,0.039105043,0.032455567,0.03026327,0.028098399,0.04152102
b2f49740-9aca-480b-bb19-37860e7c2926,Censorship!!! ,male,"Cancun, Mexico",2023-10-25,NEGATIVO,0,0.64945734,0.07974197,0.066439584,0.061951187,0.057525534,0.084884405
4a4b1eff-98de-43a7-a289-d5106765451c,My posts suddenly stopped reaching people… no explanation. Feels like I’m being censored.,male,"Windhoek, Namibia",2022-12-01,NEGATIVO,2,0.036230896,0.04480361,0.8037329,0.034828812,0.032295905,0.04810795
00f60a42-b9f1-459c-985c-939b46f9a2e6,I feel like I'm gonna mad i enter the right password but i can't log in i try so many times but still i can't login please fix this. I realise this is worst app ever very very angry 😡😡😡😡😡,female,"Brisbane, Australia",2025-05-10,NEGATIVO,1,0.025156962,0.8691074,0.026348408,0.024071304,0.022334732,0.032981075
ff2cf2e4-ea9a-41ca-a7b0-ee177d211c2f,"After the updates my Instagram account got disabled and can't find my ID is Instagram hacked as still I can't access my account (Facebook, messanger and instagram). Awaiting prompt response from the developer.",male,"Houston, United States",2023-12-24,NEGATIVO,3,0.024844138,0.030835547,0.025575161,0.60996574,0.022157723,0.28662175
7a9747e9-e170-46fc-ae2a-22224855503e,"Alot of Bugs, I didn't Follow more then 2 or 3 Account for Business, somehow got follow to 400+ Insta Account, useless app",male,"Córdoba, Argentina",2024-07-31,NEGATIVO,4,0.033240475,0.04136203,0.034267593,0.03192262,0.8154243,0.043782935
f334fa67-2501-40f0-be68-f522e84a5ffe,"My mobile is not open Instagram shreen Black/white problem ,my mobile realme 6i",male,"Dakar, Senegal",2023-07-01,NEGATIVO,0,0.7501312,0.056867655,0.04734584,0.04414198,0.040983323,0.060530003
21378817-7674-469a-a4c5-0f2faa7fcc65,Unable to unrestricted id,male,"San Francisco, United States",2024-04-19,NEGATIVO,2,0.05197636,0.064222164,0.71924406,0.049885646,0.046320915,0.06835085
4d2bbf81-64cf-43a8-9572-476d5a0fbce4,"Won't let me post reels with music that they provide playing in my reel. Said that I was restricted, don't know what I did wrong.",male,"Chennai, India",2022-10-02,NEGATIVO,0,0.46749985,0.03731034,0.031079879,0.33292118,0.09149613,0.039692648
663afb09-d4ec-42e0-b32d-2c4f9e082f03,Pls help me i can't unrestricte some accounts I did help me and fix ur bug,male,"Amsterdam, Netherlands",2021-06-21,NEGATIVO,1,0.036489025,0.8103348,0.03758193,0.035041448,0.03253743,0.048015397
9e3a1aad-ddee-411c-8e70-8a3dc4ebdfe0,Not opening,male,"Phoenix, United States",2024-01-24,NEGATIVO,3,0.064497486,0.079743,0.06644014,0.64690834,0.057525948,0.08488501
5270cbf3-fcc1-4722-ab00-295ee84d5fbc,"Very bad. I got flagged for something harmless, but I still see worse content everywhere.",male,"Bangkok, Thailand",2022-11-07,NEGATIVO,0,0.6407088,0.04097835,0.034136675,0.031832702,0.11579533,0.13654816
bd434658-aaab-4110-ba73-e2ac483e1fbf,This app totally sucks. Nothing ever works. It's absolutely pointless. I'll spent my whole life convincing people to stop using it.,male,"Quebec City, Canada",2023-10-17,NEGATIVO,0,0.4306124,0.4290482,0.034428596,0.032101717,0.02980845,0.04400062
f5eecada-eedf-48e6-be36-033ff804772f,My videos keep getting flipped upside down - always a problem,female,"Christchurch, New Zealand",2025-08-13,NEGATIVO,1,0.3105053,0.5552281,0.03269951,0.030493522,0.028308975,0.042764477
7f969d11-d9d1-4867-b621-18ba10706723,Worst app I've ever seen it has so many bugs and problems with user names I've tried 30 user names and app suggested user names but it doesn't accepting any one of them what a shittt app🖕🖕🖕😡😡🤬🤬🥺🥺,male,"Tripoli, Libya",2023-05-18,NEGATIVO,0,0.35005972,0.29775473,0.021094725,0.019613907,0.018215243,0.2932616
0ea2fa2a-78cb-4255-944b-591888e5b0ad,It didn't even notify me when someone send me msg,male,"Chennai, India",2022-07-23,NEGATIVO,0,0.778375,0.050423946,0.04200292,0.039165325,0.03636888,0.05366384
e3b92ab6-e9fc-485c-a438-ad139b1e6f06,My Instagram account has been locked 🔒 Instagram report but Instagram not reply my account 70 days plz my account return Instagram,male,"Harare, Zimbabwe",2023-02-15,NEGATIVO,1,0.03167122,0.5960323,0.032622613,0.03041371,0.2675872,0.04167292
7d157d23-16ea-4323-99bf-390e4324f06a,👵🏻,female,"Melbourne, Australia",2025-09-08,NEGATIVO,1,0.03491032,0.8184619,0.03601264,0.033532307,0.031136813,0.045946125
190cecd7-f74b-4414-b6a5-734b4e608e92,many tools doesn't work! if you wanna change Facebook page you cant ! no customer support available is very terrible,female,"Adelaide, Australia",2025-09-16,NEGATIVO,3,0.0287537,0.035771944,0.029589128,0.84239936,0.025615452,0.037870385
c4795e82-dc86-4d9f-94d7-b5f5a09442e6,"the more it is updated, the worse it gets",male,"Perth, Australia",2025-04-15,NEGATIVO,0,0.7480264,0.05735568,0.04778149,0.04449733,0.041305955,0.06103323
810ffa16-8375-41e2-8585-9be0db74eb74,Monetized nonsense.,female,"Melbourne, Australia",2025-08-19,NEGATIVO,4,0.06449766,0.079742774,0.06644025,0.0619518,0.6424823,0.08488526
55fa9b52-7afe-44be-b478-e15f548112a6,"For me, my posts barely reach anyone anymore. It makes the experience less enjoyable.",male,"Busan, South Korea",2022-06-20,NEGATIVO,3,0.022958156,0.028386157,0.023652881,0.57010347,0.0204761,0.33442324
0986dfeb-da9c-405a-a339-6ef9b1612cf6,The main problem is that it feels like everything is about Reels now. It gets frustrating after a while.,male,"Valencia, Spain",2021-10-29,NEGATIVO,2,0.024491543,0.030305764,0.7069607,0.18407117,0.021843918,0.03232691
b9d05483-ea3f-49bb-898a-2e0d0c8db657,"I wanted to like it, but i have followers but very little engagement. It ends up feeling repetitive.",male,"Jerusalem, Israel",2022-06-19,NEGATIVO,5,0.024474632,0.030311922,0.025232576,0.023513615,0.021832567,0.8746347
d194e61d-037f-4053-9cf9-1722274a0847,The main problem is that there are too many bots and fake accounts. It makes it harder to grow.,male,"Tokyo, Japan",2022-11-12,NEGATIVO,5,0.023219991,0.028875029,0.023921313,0.022305312,0.020709552,0.8809688
23113299-365c-4b31-8d0c-a51a37495525,What bothers me is that my account got restricted without a clear reason. That part could definitely be improved.,male,"Bali, Indonesia",2022-03-24,NEGATIVO,4,0.021056285,0.026079556,0.021692527,0.020225966,0.8832131,0.027732598
5ba9f878-5922-498d-812a-9ad56d1a9476,"I wanted to like it, but you need to pay to get visibility. It gets frustrating after a while.",male,"Boston, United States",2024-03-15,NEGATIVO,2,0.025283774,0.031276044,0.8632579,0.02429006,0.022550749,0.03334158
b6f329a9-9da8-44bb-8051-479690303056,"Personally, it makes me compare myself too much. It gets frustrating after a while.",male,"Kampala, Uganda",2023-04-26,NEGATIVO,0,0.84724164,0.034716174,0.028902844,0.02693459,0.024997525,0.037207205
47bf996d-9f92-460f-a52a-c1fde05dff82,"Honestly, i keep seeing the same content repeatedly. It makes it harder to grow.",male,"Asunción, Paraguay",2025-02-27,NEGATIVO,5,0.024408458,0.030185377,0.025147447,0.023447696,0.021770297,0.87504077
21bf968f-1222-43e6-8865-c860fbc25267,"So far, the app feels too complicated now. It ends up feeling repetitive.",male,"Bali, Indonesia",2022-04-10,NEGATIVO,1,0.026797611,0.86049896,0.027622338,0.025746128,0.023904236,0.035430674
f673b4b9-f282-4dd6-ad8a-f20b4ab12d63,I’d say sometimes it feels hard to grow organically. It makes the experience less enjoyable.,male,"Montevideo, Uruguay",2024-08-20,NEGATIVO,3,0.022125985,0.027426433,0.022798242,0.4906604,0.019734148,0.41725478
58bb4b78-e07a-4e5a-84e9-b0f67cf6a4de,The main problem is that my posts barely reach anyone anymore. It gets frustrating after a while.,male,"Kathmandu, Nepal",2022-07-11,NEGATIVO,3,0.02310289,0.02857298,0.023803124,0.87347573,0.02060494,0.030440362
a8a85643-5eaa-4724-9ebe-b7934fe1b19c,"For me, it feels like everything is about Reels now. It slows things down.",male,"Chicago, United States",2024-01-20,NEGATIVO,2,0.027794698,0.034394987,0.8497219,0.026698556,0.024790077,0.03659976
3377e522-6dff-43a5-9c24-eb0a2134e4d6,What bothers me is that i have followers but very little engagement. It makes the app harder to enjoy.,male,"Lagos, Nigeria",2023-01-09,NEGATIVO,5,0.024550822,0.030363442,0.025295217,0.023582218,0.021896783,0.8743115
e1ee4ce3-794d-4cfe-be32-8dd98d1cc530,"Personally, there are too many bots and fake accounts.",male,"Munich, Germany",2021-09-08,NEGATIVO,1,0.030227723,0.8427739,0.031141771,0.029033512,0.026960082,0.039862998
5671e12a-34d7-4b62-8fa9-8a1eb97c4c78,I’d say my account got restricted without a clear reason. It makes it harder to grow.,male,"Busan, South Korea",2022-06-22,NEGATIVO,4,0.022139546,0.02738893,0.022818418,0.021273684,0.8770613,0.029318225
fd428431-f8d1-4904-89ad-c54322a6f86f,"For me, you need to pay to get visibility. It ends up feeling repetitive.",male,"Toronto, Canada",2024-06-18,NEGATIVO,2,0.025743686,0.03186988,0.86076325,0.024731439,0.022963716,0.033928044
5733cc20-7d5f-41a8-8ae8-2a0e2e2585e3,The main problem is that it makes me compare myself too much. It makes it harder to grow.,male,"Ottawa, Canada",2023-09-13,NEGATIVO,5,0.025164977,0.031117074,0.025923394,0.024171496,0.022442479,0.87118053
472869a2-4be3-44c4-831a-28d4693b6f14,One issue is that i keep seeing the same content repeatedly. It makes it harder to grow.,male,"Toronto, Canada",2023-10-19,NEGATIVO,5,0.023609767,0.029241966,0.024322899,0.022682825,0.021059018,0.8790835
426d5d0a-f1f4-4ed6-996d-280573ecd106,The main problem is that the app feels too complicated now. It slows things down.,male,"Bali, Indonesia",2022-03-24,NEGATIVO,1,0.026157845,0.863705,0.026965298,0.025137523,0.023332052,0.034702275
a2981a3b-8dfc-47eb-b674-362037349b83,"I wanted to like it, but sometimes it feels hard to grow organically. It makes it harder to grow.",male,"San Jose, United States",2024-01-14,NEGATIVO,3,0.022770636,0.028301263,0.023473203,0.79602176,0.02030999,0.10912323
0f7d5ce4-df4b-433d-b618-3442b7be030f,The main problem is that my posts barely reach anyone anymore.,female,"Brisbane, Australia",2025-12-25,NEGATIVO,3,0.025714992,0.03179949,0.026491022,0.85918075,0.022934996,0.03387871
0c9006c0-aa1b-4a64-a4fc-9f2cf8db88d6,"So far, it feels like everything is about Reels now. It makes the app harder to enjoy.",male,"Lima, Peru",2025-02-28,NEGATIVO,2,0.023388132,0.028947076,0.8733602,0.022465225,0.0208586,0.03098068
aaebd8c2-20ad-4147-aeca-e03637b3808d,The main problem is that i have followers but very little engagement. It gets frustrating after a while.,male,"Tijuana, Mexico",2024-02-22,NEGATIVO,5,0.025949929,0.0321081,0.026744924,0.02493188,0.023143254,0.8671219
203a222c-715e-40cc-a442-9cd55f86b50e,One issue is that there are too many bots and fake accounts. It makes it harder to grow.,female,"Nadi, Fiji",2025-11-20,NEGATIVO,1,0.02320307,0.5264687,0.023907969,0.022292929,0.020696009,0.38343126
9748570b-859e-4b5c-a791-45fa7b412687,What bothers me is that my account got restricted without a clear reason. That part could definitely be improved.,female,"Hobart, Australia",2025-07-19,NEGATIVO,4,0.021056287,0.026085252,0.02169253,0.02022597,0.88320744,0.027732614
caa01a5e-121b-47ed-a4d7-77fefbbcc388,What bothers me is that you need to pay to get visibility. It makes it harder to grow.,male,"Washington DC, United States",2024-02-24,NEGATIVO,2,0.02459954,0.030423045,0.86690944,0.02363413,0.021940958,0.032492913
63621fb4-52b5-4959-bda1-955b4126f8ec,"Personally, it makes me compare myself too much. It ends up feeling repetitive.",male,"Geneva, Switzerland",2021-07-29,NEGATIVO,4,0.025997756,0.03216811,0.026779726,0.024962867,0.8556801,0.03441145
51bb8bd3-bdf7-442b-b748-e6f0ab76aa43,The main problem is that i keep seeing the same content repeatedly. It makes it harder to grow.,male,"Rome, Italy",2021-11-08,NEGATIVO,5,0.023173144,0.028657706,0.023875264,0.022262754,0.020668345,0.8813628
c2d894a4-cf2d-4140-9b2c-1cfa0889ac6f,One issue is that the app feels too complicated now. That part could definitely be improved.,male,"Berlin, Germany",2021-09-22,NEGATIVO,1,0.023241155,0.87913567,0.023941943,0.022324858,0.020731064,0.030625336
40403c26-1866-41e3-a772-8725f19d1be1,"Personally, sometimes it feels hard to grow organically.",male,"Addis Ababa, Ethiopia",2023-06-29,NEGATIVO,3,0.027752629,0.034385033,0.028597102,0.8479422,0.024752915,0.036570136
d0eeaf46-04fe-4290-8476-c471d114fec9,"In my experience, my posts barely reach anyone anymore. It makes it harder to grow.",male,"Alexandria, Egypt",2023-02-22,NEGATIVO,3,0.023187902,0.02867435,0.023892734,0.8728873,0.020681435,0.030676309
16955849-d742-47c0-b4f2-ad8a13689165,What bothers me is that it feels like everything is about Reels now. It makes the experience less enjoyable.,female,"Port Moresby, Papua New Guinea",2025-11-19,NEGATIVO,2,0.023202198,0.028697003,0.61043966,0.022287628,0.020694092,0.29467943
